Apple,10 Impressive Health Benefits of Apples,"Dec 17, 2018 ... Apples are a good source of antioxidants, fiber, water, and several nutrients. The many healthy components of apples may contribute to fullness ...",https://www.healthline.com/nutrition/10-health-benefits-of-apples
Apple,7 Outstanding Health Benefits of Apples | Everyday Health,"Oct 2, 2020 ... 3. Apples Can Support a Healthy Immune System · 3. Apples Can Support a Healthy Immune System · 7 Foods That Fight Back: Immune System Boosters ...",https://www.everydayhealth.com/diet-nutrition/impressive-health-benefits-of-apples/
Apple,Apples: Nutrition & Health Benefits,"Aug 19, 2020 ... Apples are low in sodium, fat, and cholesterol. They don't offer protein, but apples are a good source of vitamin C and fiber. One medium apple ...",https://www.webmd.com/food-recipes/benefits-apples
Apple,"Apples: Benefits, nutrition, and tips","Apples containTrusted Source fiber, vitamin C, antioxidants, and potassium. A medium sized apple providesTrusted Source the following: ... Fiber appears to help ...",https://www.medicalnewstoday.com/articles/267290
Apple,5 Health Benefits of an Apple | EatingWell,Apples' cancer-fighting antioxidant activity is nearly tops among fruits (second only to cranberries). Eating an apple a day (or more) is linked with lower risk ...,https://www.eatingwell.com/article/17769/5-health-benefits-of-an-apple/
Apple,iOS - Health - Apple,With a healthy dose of updates. The Health app was created to help organize your important health information and make it easy to access in a central and ...,https://www.apple.com/ios/health/
Apple,Apples | The Nutrition Source | Harvard T.H. Chan School of Public ...,"The phytochemicals and fiber in apples have antioxidant effects that may protect a cell's DNA from oxidative damage, which is a precursor to cancer. Animal and ...",https://www.hsph.harvard.edu/nutritionsource/food-features/apples/
Apple,The Best Healthy Apple Crisp Recipe | Ambitious Kitchen,"Sep 2, 2021 ... Healthy apple crisp naturally sweetened with maple syrup and topped with a crunchy oat pecan topping! Serve warm with vanilla ice cream.",https://www.ambitiouskitchen.com/healthy-apple-crisp/
Apple,The Healthy Apple,The Healthy Apple · Start Here · The Valpone Method · Recipes · The Cooking Glossary · Breakfast · Lunch · Dinner · Appetizers + Snacks · Soups · Salads ...,https://thehealthyapple.com/
Apple,Healthy Apple Crisp - The Clean Eating Couple,"This Healthy Apple Crisp recipe is gluten/dairy free, and sweetened with just maple syrup. Naturally sweet & delicious it's the perfect healthy dessert!",https://thecleaneatingcouple.com/healthy-apple-crisp/
Apple,Track workouts and stay healthy with Apple Watch - Official Apple ...,"Learn everything you need to know about tracking work outs, staying healthy and meeting your fitness goals with your Apple Watch.",https://support.apple.com/watch/workout
Apple,What Happens To Your Body When You Eat an Apple Every Day ...,"Dec 28, 2020 ... Apples are full of one nutrient most people don't get enough of—fiber. With 5 grams per medium fruit, a single apple knocks out 20% of your ...",https://www.eatthis.com/what-happens-body-eat-apple-every-day/
Apple,"An apple a day may not keep the doctor away, but it's a healthy ...","Apr 2, 2015 ... This week's inaugural April Fool's Day edition of JAMA Internal Medicine carried a report entitled “Association Between Apple Consumption ...",https://www.health.harvard.edu/blog/an-apple-a-day-may-not-keep-the-doctor-away-but-its-a-healthy-choice-anyway-201504027850
Apple,Healthy Apple Muffins Recipe - Cookie and Kate,"Amazing, healthy apple muffins made with maple syrup and whole wheat flour! No one will guess that this simple cinnamon apple muffin recipe is healthy, too.",https://cookieandkate.com/healthy-apple-muffins-recipe/
Apple,Which Apple Is the Healthiest For You? | SelectHealth,"If you're looking for an apple that has been scientifically proven to help with weight loss, Granny Smith apples should become a regular part of your nutrition.",https://selecthealth.org/blog/2016/07/healthiest-apple
Apple,Apple Health (Medicaid) coverage | Washington State Health Care ...,"In Washington State, Medicaid is called Apple Health. Apple Health provides preventative care, like cancer screenings, treatment for diabetes and high blood ...",https://www.hca.wa.gov/health-care-services-supports/apple-health-medicaid-coverage
Apple,The health benefits of apples - BBC Good Food,"Sep 12, 2020 ... 1. May lower cholesterol. Apples contain pectin, a natural fibre found in plants. · 2. May protect against diabetes. Apples are low on the ...",https://www.bbcgoodfood.com/howto/guide/health-benefits-apples
Apple,‎Healthy Together - COVID-19 on the App Store,This app is available only on the App Store for iPhone. Healthy Together - COVID-19 4+.,https://apps.apple.com/us/app/healthy-together-covid-19/id1507570835
Apple,Best-Ever Healthy Apple Crisp - Healthy Liv,"Nov 7, 2016 ... This healthy apple crisp has wholesome ingredients like oats, almond flour, nuts, cinnamon, coconut oil, and pure maple syrup.",https://www.healthy-liv.com/best-ever-healthy-apple-crisp/
Apple,‎Healthy Home Hacks Podcast on Apple Podcasts,"How would you like to up-level your health, enjoy more energy, and keep your family safe from the dangerous daily toxins that are wreaking havoc on your ...",https://podcasts.apple.com/us/podcast/healthy-home-hacks-podcast/id1526750190
Celery,Benefits of Celery: For Your Health,"Celery contains vitamin C, beta carotene, and flavonoids, but there are at least 12 additional kinds of antioxidant nutrients found in a single stalk. It's also ...",https://www.healthline.com/health/food-nutrition/health-benefits-of-celery
Celery,"Celery: Health Benefits, Nutrients, Preparation, and More","Aug 31, 2020 ... Widely recognized as one of the healthiest snacks available, celery is a wonderful source of fiber. Its fiber content is especially impressive ...",https://www.webmd.com/diet/health-benefits-celery
Celery,"Celery: Health benefits, nutrition, diet, and risks",The fiber in celery can benefit the digestive and cardiovascular systems. Celery also contains antioxidants that may play a role in preventing disease. This ...,https://www.medicalnewstoday.com/articles/270678
Celery,Top 5 health benefits of celery - BBC Good Food,"Although celery has a high water content, it contains numerous vitamins and minerals, including potassium and calcium, which are important for heart health. It ...",https://www.bbcgoodfood.com/howto/guide/health-benefits-celery
Celery,What Are the Benefits of Eating Celery?,"Mar 4, 2021 ... Celery is a vegetable that provides many health benefits. It is rich in fiber and nutrients and helps lower cholesterol, treats constipation ...",https://www.medicinenet.com/what_are_the_benefits_of_eating_celery/article.htm
Celery,Celery: Health benefits & nutrition facts | Live Science,"Apr 27, 2015 ... Celery can also help you get enough folate, potassium, fiber and the micronutrient molybdenum. It contains small amounts of vitamin C, vitamin A ...",https://www.livescience.com/50640-celery-nutrition.html
Celery,Celery Health Benefits: 5 Reasons You Should Eat This Vegetable,"Sep 13, 2019 ... Celery contains a welcome dose of some important vitamins and minerals. For example, a mere stalk can provide 25% of your daily vitamin K needs.",https://foodrevolution.org/blog/celery-health-benefits/
Celery,11 Incredible Celery Benefits & Nutrition Facts,"May 14, 2021 ... Rich in vitamin A and C as well as antioxidants, celery may greatly boost the immune system and make it more active and efficient. Eating this ...",https://www.organicfacts.net/health-benefits/vegetable/health-benefits-of-celery.html
Celery,Celery: A wonder food that makes you lose weight and improves ...,"Feb 10, 2016 ... Is great for heart health: Administered as an anti-hypertensive agent in traditional medicines, celery proves to be of great help when it comes ...",https://www.indiatoday.in/lifestyle/wellness/story/celery-a-wonder-food-that-makes-you-lose-weight-and-improves-heart-health-superfood-bloating-digestion-307976-2016-02-10
Celery,"What Happens to Your Body When You Eat Celery, Say Experts ...","Apr 3, 2021 ... Antioxidants are the name of the cancer-fighting game and if you eat celery, it's chock-full of them. Antioxidants help neutralize cancer- ...",https://www.eatthis.com/what-happens-body-eat-celery/
Celery,Celery May Help Bring Your High Blood Pressure Down ...,"Dec 9, 2020 ... celery seeds. At almost every turn, science and medicine reveal a new “superfood” that will dramatically improve our health.",https://health.clevelandclinic.org/celery-may-help-bring-your-high-blood-pressure-down/
Celery,The Top 10 Foods for Healthy Bladder and Kidneys,"Nov 29, 2018 ... Celery is known to remove toxins, wastes, and contaminants from your body. Studies have shown that regular consumption of celery can help ...",https://www.allaboutincontinence.co.uk/blog/foods-for-healthy-bladder-kidneys
Celery,Is Celery Juice Actually Healthy? – Cleveland Clinic,"Jan 15, 2019 ... Celery juice and celery stalk on white background. Q: I've been hearing that drinking celery juice in the morning has some health-promoting ...",https://health.clevelandclinic.org/celery-juice-is-a-trendy-detox-drink-but-does-it-actually-have-benefits/
Celery,Does Putting Ranch on Celery Negate the Health Benefits?,Celery is a low-calorie vegetable that supplies a healthy dose of certain nutrients. It is common to eat celery sticks with a side of ranch dressing for ...,https://healthyeating.sfgate.com/putting-ranch-celery-negate-health-benefits-3836.html
Celery,What Are the Benefits of Celery Juice? | Everyday Health,"Mar 4, 2019 ... Before crowning it a miracle food, though, says Moore, it's important to note that celery is like many other fruit and vegetables that contain ...",https://www.everydayhealth.com/diet-nutrition/what-are-benefits-celery-juice/
Celery,Health Benefits of Celery | Health.com,"Jan 27, 2020 ... While celery is largely water, it also provides several vital vitamins and minerals. The veg's vitamin A supports immunity, skin, and eye health ...",https://www.health.com/food/health-benefits-celery
Celery,Negative-calorie foods: Diet gimmick or weight-loss aid? - Mayo Clinic,"Foods that contain few calories, such as celery and other nonstarchy vegetables, ... The key to successful weight loss is adopting a healthy lifestyle that ...",https://www.mayoclinic.org/healthy-lifestyle/weight-loss/expert-answers/negative-calorie-foods/faq-20058260
Celery,Can Dogs Eat Celery?​ – American Kennel Club,"Aug 15, 2016 ... Celery is listed among the vegetables that are safe for dogs by ... your dog does not need the extra nutrients in celery to stay healthy.",https://www.akc.org/expert-advice/nutrition/can-dogs-eat-celery/
Celery,Is Celery Juice a Sham? - The New York Times,"Oct 16, 2019 ... Food is complex, and just because a food is high in flavones doesn't translate into guaranteed health benefits. Compounds like flavones are ...",https://www.nytimes.com/2019/10/16/style/self-care/celery-juice-benefits.html
Celery,Top 8 Health Benefits of Celery for Seniors,"Mar 19, 2018 ... Inflammation is one of the many contributing factors to heart disease, cancer, and arthritis. Eating celery is a good way to lower inflammation ...",https://www.hendersonhomecareassistance.com/benefits-of-celery-for-the-elderly/
Whole+Grain+Oats,9 Health Benefits of Eating Oats and Oatmeal,"Jul 19, 2016 ... Oats may be the healthiest whole grain food on the planet. They are a great source of many vitamins, minerals and antioxidants. Raw oats contain ...",https://www.healthline.com/nutrition/9-benefits-oats-oatmeal
Whole+Grain+Oats,Oats | The Nutrition Source | Harvard TH Chan School of Public Health,"The grain refers specifically to the edible seeds of oat grass, which is what ends up in our breakfast bowls. Whether loved or hated for their mushy yet hearty ...",https://www.hsph.harvard.edu/nutritionsource/food-features/oats/
Whole+Grain+Oats,Is Oatmeal Good For You? Here's What the Experts Say | TIME,"Aug 15, 2018 ... Steel-cut or rolled, oatmeal is a healthy gluten-free food—as long as you prepare it right. Here's how to make oatmeal that's good for you.",https://time.com/5368076/is-oatmeal-healthy-good-for-you/
Whole+Grain+Oats,"Which Kind of Oatmeal is Healthiest: Instant Oatmeal, Rolled Oats ...","Dec 5, 2017 ... It's no secret that oatmeal is part of a healthy and balanced diet. However, of all the healthy whole grains out there, oatmeal seems to be ...",https://www.cookinglight.com/eating-smart/smart-choices/which-kind-of-oatmeal-is-healthiest
Whole+Grain+Oats,7 Reasons to Eat Oatmeal Every Day | Everyday Health,"Mar 20, 2019 ... Oats contain both soluble and insoluble fiber. Soluble fiber forms a viscous gel that helps to lower cholesterol and stabilize blood glucose ...",https://www.everydayhealth.com/columns/bonnie-taub-dix-nutrition-intuition/reasons-why-you-should-eat-oatmeal-every-day/
Whole+Grain+Oats,"Oats: Health benefits, facts, research","They found that eating foods rich in whole-oat sources of soluble fiber (oats, oat bran, and oat flour) may help reduce the risk of coronary heart disease. They ...",https://www.medicalnewstoday.com/articles/270680
Whole+Grain+Oats,6 Oatmeal Mistakes Making You Fat | Eat This Not That,"May 7, 2021 ... This seemingly healthy breakfast can turn into a sugary, ... But even though it's made with whole grain oats, oatmeal is pretty carb-heavy.",https://www.eatthis.com/oatmeal-mistakes/
Whole+Grain+Oats,8 health benefits of oatmeal and how to make it,"Jan 14, 2019 ... It is important to understand that whole grain oats offer the most nutritional value. Steel-cut or rolled whole-grain oats retain all the fiber ...",https://www.medicalnewstoday.com/articles/324176
Whole+Grain+Oats,"The Difference Between Whole Grain, Whole Oats and Whole Wheat ...","Whole oats are oats that still contain their endosperm, bran and germ. Whole oats are an excellent source of fiber, protein and vitamins. Studies have shown ...",https://www.fitday.com/fitness-articles/nutrition/healthy-eating/the-difference-between-whole-grain-whole-oats-and-whole-wheat.html
Whole+Grain+Oats,Health Benefits of Whole Grain Oats,"Jan 13, 2015 ... What are the Health Benefits of Whole Grains? · Provide cholesterol-lowering effect – Beta-glucan, a type of soluble fiber, is found in oats and ...",https://www.medindia.net/patients/lifestyleandwellness/health-benefits-of-whole-grain-oats.htm
Whole+Grain+Oats,The gut microbiota and cardiovascular health benefits: A focus on ...,Existing scientific data suggest that a high intake of wholegrain foods contributes to improved gut health and a ...,https://onlinelibrary.wiley.com/doi/full/10.1111/nbu.12354
Whole+Grain+Oats,Avenanthramide Metabotype from Whole-Grain Oat Intake is ...,Avenanthramide Metabotype from Whole-Grain Oat Intake is Influenced by Faecalibacterium ... J Nutr. 2021 Jun 1;151(6):1426-1435. doi: 10.1093/jn/nxab006.,https://pubmed.ncbi.nlm.nih.gov/33694368/
Whole+Grain+Oats,Whole-grain oats: Best bet for lowering cholesterol - Harvard Health,"Oct 19, 2015 ... Among the different types of whole grains, oats appear to be the most effective when it comes to lowering cholesterol levels.",https://www.health.harvard.edu/heart-health/research-were-watching-whole-grain-oats-best-bet-for-lowering-cholesterol
Whole+Grain+Oats,"Oats are not just healthy for your heart, but for your whole body ...","Mar 22, 2013 ... Oats are most frequently known for their heart healthy nutrition claim in the media, but this grain has many more benefits than just heart ...",https://www.canr.msu.edu/news/oats_are_not_just_health_for_your_heart_but_for_your_whole_body
Whole+Grain+Oats,30 Best Healthy Breakfast Cereals - Whole Grain Cereal List,"Jul 31, 2020 ... These whole-grain cereals are a smart pick for your healthy diet. ... or whole food as the first ingredient (like whole-grain oats, wheat, ...",https://www.goodhousekeeping.com/food-products/g4111/best-healthy-cereal/
Whole+Grain+Oats,Whole grains: Hearty options for a healthy diet - Mayo Clinic,"Examples of whole grains include: Barley; Brown rice; Buckwheat; Bulgur (cracked wheat); Millet; Oatmeal; Popcorn; Whole-wheat bread, pasta or ...",https://www.mayoclinic.org/healthy-lifestyle/nutrition-and-healthy-eating/in-depth/whole-grains/art-20047826
Whole+Grain+Oats,What Are Whole Grains? | Quaker Oats,Tips for Adding Whole Grains to Your Diet. Whole grains are versatile and can be easily incorporated into a healthy lifestyle. A variety of whole grain foods ...,https://www.quakeroats.com/oats-do-more/for-your-health/fiber-and-whole-grains/what-are-whole-grains
Whole+Grain+Oats,Weight loss: 5 ways your oatmeal can make you fat! | The Times of ...,"Apr 8, 2021 ... Oatmeal is one of the best breakfast options for those trying to ... or go for overnight oats recipes, this whole grain cereal can curb your ...",https://timesofindia.indiatimes.com/life-style/health-fitness/weight-loss/weight-loss-5-ways-your-oatmeal-can-make-you-fat/photostory/69484165.cms
Whole+Grain+Oats,The Whole Truth About Whole Grains – Cleveland Clinic,"Aug 7, 2020 ... 100% whole-grain (wheat, corn, oat) cereals. Of course, you can cook or bake your own items using some of the healthy products listed below. ( ...",https://health.clevelandclinic.org/the-whole-truth-about-whole-grains/
Whole+Grain+Oats,Grains | MyPlate,"Make half your grains whole grains. What foods are in the Grains Group? Any food made from wheat, rice, oats, cornmeal, barley, or another cereal grain is a ...",https://www.myplate.gov/eat-healthy/grains
Corn+Starch,The 9 best cornstarch substitutes for health,"There are plenty of good substitutes for cornstarch. Easy-to-access alternatives are wheat flour, arrowroot flour, and rice flour. These are good alternatives ...",https://www.medicalnewstoday.com/articles/324035
Corn+Starch,Is Cornstarch Bad for You? Nutrition and Health Effects,"Aug 28, 2020 ... Cornstarch is high in calories and carbs but low in essential nutrients. It may also increase blood sugar levels and harm heart health.",https://www.healthline.com/nutrition/is-cornstarch-bad-for-you
Corn+Starch,What is Cornstarch and Is Cornstarch Bad For Me?,"Cornstarch isn't unhealthy in small amounts, however it does add calories and carbohydrates to foods. Like any refined carbohydrate, it's okay to consume in ...",https://www.accordingtoelle.com/cornstarch-what-is-it-and-is-it-bad-for-me/
Corn+Starch,What Are the Health Benefits of Cornstarch? | Livestrong.com,"Aug 23, 2019 ... Your digestive system breaks down carbohydrates into glucose, which your body uses as fuel. Without the fiber, fat or protein to slow down this ...",https://www.livestrong.com/article/479831-what-are-the-health-benefits-of-cornstarch/
Corn+Starch,The 11 Best Substitutes for Cornstarch,The 11 Best Substitutes for Cornstarch · 1. Wheat flour · 2. Arrowroot · 3. Potato starch · 4. Tapioca · 5. Rice flour · 6. Ground flaxseeds · 7. Glucomannan · 8.,https://www.healthline.com/nutrition/substitutes-for-cornstarch
Corn+Starch,Is Corn Starch Bad For You? - Here Is Your Answer.,"Dec 19, 2017 ... Corn starch is a gluten-free carbohydrate that is used mainly as a liquid thickener in gravies, soups, sauces, glazes, pies and desserts.",https://www.isitbadforyou.com/questions/is-corn-starch-bad-for-you
Corn+Starch,Cornstarch Nutrition Facts and Health Benefits,"Cornstarch provides no significant vitamins or minerals. Even if it is consumed in larger quantities than is typical in recipes, the powder does not contribute ...",https://www.verywellfit.com/cornstarch-nutrition-facts-and-health-benefits-5084478
Corn+Starch,Is Cornstarch Really As Bad As You Think?,"Feb 22, 2021 ... Cornstarch is mostly made up of starch and has a relatively high calorie count, but little nutritional content (via Medical News Today). It can ...",https://www.healthdigest.com/338912/is-cornstarch-really-as-bad-as-you-think/
Corn+Starch,Is cornstarch bad for you? Why or why not? - Quora,"Cornstarch is not one of the healthiest carbohydrates, since it is very low in dietary fiber. It can still be a part of a healthy diet, however, ...",https://www.quora.com/Is-cornstarch-bad-for-you-Why-or-why-not
Corn+Starch,Modified Food Starch: What Is It? | Bob's Red Mill,"Healthy Living, Learning Center on May 16, 2012 by Cassidy Stockton ... will list the source from which the starch was modified as Modified Corn Starch, ...",https://www.bobsredmill.com/blog/healthy-living/modified-food-starch-demystified/
Corn+Starch,Is Arrowroot Powder Really Better for You Than Corn Starch?,"What is arrowroot powder and is it healthy for you? While containing similar properties to corn starch, the outcome of using Arrowroot in cooking is ...",https://spoonuniversity.com/lifestyle/is-arrowroot-powder-really-better-for-you-than-corn-starch
Corn+Starch,Cornstarch vs. Potato Starch | Bob's Red Mill,"Healthy Living, Learning Center on April 28, 2020 by Bob's Red Mill ... Cornstarch and potato starch are two of the most common starches out there, ...",https://www.bobsredmill.com/blog/healthy-living/cornstarch-vs-potato-starch-which-ones-better/
Corn+Starch,Flour and Corn Starch Use in Home Canning - Healthy Canning,Starch in home-canned soups. No tested soup recipes for home canning that we know of currently allow for addition of a flour or cornstarch ingredient. That ...,https://www.healthycanning.com/flour-and-corn-starch-use-in-home-canning/
Corn+Starch,Baking With Cornstarch | Bob's Red Mill,"Apr 28, 2020 ... Looking for more information on how to use cornstarch in your baked goods? You're not alone. More and more bakers are swapping starches for ...",https://www.bobsredmill.com/blog/healthy-living/baking-with-cornstarch-everything-you-need-to-know/
Corn+Starch,Is Cornstarch Gluten-Free? (And Other Questions) - Dr. Axe,"Sep 24, 2018 ... Is cornstarch bad for you? Cornstarch is a processed starch, and it only contains calories and carbohydrates — no protein, sugars, fiber, ...",https://draxe.com/nutrition/is-cornstarch-gluten-free/
Corn+Starch,"Role of Resistant Starch in Improving Gut Health, Adiposity, and ...","Mar 5, 2015 ... Generally, corn starch that can be bought in the supermarket is ∼80% amylopectin and 20% amylose. Thus, the Hi-maize product is considered a ...",https://www.ncbi.nlm.nih.gov/pmc/articles/PMC4352178/
Corn+Starch,The 11 Best Cornstarch Substitutes To Cook And Bake With,"May 20, 2020 ... The 11 Best Cornstarch Substitutes To Thicken Up Any Recipe · 1 Arrowroot. Bob's Red Mill Arrowroot Starch / Flour amazon.com · 2 All-Purposes ...",https://www.womenshealthmag.com/food/g32613197/cornstarch-substitute/
Corn+Starch,5 High Starch Foods to Avoid,"Oct 26, 2020 ... Alongside fiber and sugar, starch is one of the three main categories of carbohydrates. Starch is a crucial part of a diet and has many health ...",https://www.webmd.com/diet/foods-high-in-starch
Corn+Starch,Is Modified Corn Starch Bad For You? | CafeMom.com,"Apr 4, 2010 ... Great question! The modified corn starch doesn't make the food unhealthy. A lot of foods use this for texture (for yogurt to improve the ...",https://cafemom.com/lifestyle/100756-is_modified_corn_starch_bad
Corn+Starch,Is Corn Starch Gluten Free ? | Wellversed,"Is Corn Starch Gluten Free ? Articles; 01 Sep, 2020; Posted by: Wellversed Health. If you have celiac disease or a reaction to gluten, you have to be very ...",https://wellversed.in/blogs/articles/is-corn-starch-gluten-free
Sugar,Why is sugar bad for you? 5 reasons,"2 days ago ... Sugar is not unhealthful in itself. However, consuming a natural source of sugar is better for health than consuming added sugars. Having excess ...",https://www.medicalnewstoday.com/articles/324854
Sugar,8 Big Lies About Sugar We Should Unlearn,"Sugar isn't a health food, but it's also not the evil poison that it's sometimes made out to be. While most of us could stand to have less of it, it's perfectly ...",https://www.healthline.com/health/food-nutrition/sugar-facts-scientific
Sugar,The sweet danger of sugar - Harvard Health,"""The effects of added sugar intake — higher blood pressure, inflammation, weight gain, diabetes, and fatty liver disease — are all linked to an increased risk ...",https://www.health.harvard.edu/heart-health/the-sweet-danger-of-sugar
Sugar,11 Reasons Why Too Much Sugar Is Bad for You,"Jun 3, 2018 ... Eating too much added sugar can have many negative health effects. An excess of sweetened foods and beverages can lead to weight gain, blood ...",https://www.healthline.com/nutrition/too-much-sugar
Sugar,6 Darn Good Reasons to Eat Sugar and Not Apologize for It | Food ...,"Sep 4, 2017 ... And while sugar isn't a health food, it can have a place in a healthy diet. Here's when and why: Next:1. It's in its natural form.",https://health.usnews.com/wellness/food/slideshows/6-darn-good-reasons-to-eat-sugar-and-not-apologize-for-it
Sugar,Which Sugars Are Good for You — and Which Ones to Avoid ...,"Feb 17, 2021 ... For example, too much added sugar has been linked to increased risk of high blood pressure, high cholesterol, reduced “good” cholesterol, ...",https://www.everydayhealth.com/diet-and-nutrition/diet/which-sugars-are-good-you-which-ones-avoid/
Sugar,Sugar 101 | American Heart Association,"Apr 17, 2018 ... Reducing the amount of added sugars we eat cuts calories and can help you improve your heart health and control your weight. The American Heart ...",https://www.heart.org/en/healthy-living/healthy-eating/eat-smart/sugar/sugar-101
