Cheese+Cultures,Simple Homemade Cottage Cheese - Fermenting for Foodies,Homemade cottage cheese is traditionally made with cultured buttermilk. ... Mix in some fruit and you've got a healthy and wholesome treat.,https://www.fermentingforfoodies.com/homemade-cottage-cheese/
Cheese+Cultures,Cheese Cultures: Mesophilic & Thermophilic - My Fermented Foods,"Jun 19, 2021 ... Cheese cultures help ripen the milk during cheese making process. ... introducing your body to live bacteria that maintain your gut health.",https://myfermentedfoods.com/cheese-cultures/
Cheese+Cultures,Is cheese a healthy source of probiotics? - Harvard Health,"Feb 1, 2021 ... Probiotics, good bacteria that can contribute to gut and overall health, can be found in some types of cheese as well as in dietary supplements, ...",https://www.health.harvard.edu/staying-healthy/is-cheese-a-healthy-source-of-probiotics
Cheese+Cultures,Cheese Making Cultures FAQ | Cheese Making Supply Co.,"Jun 28, 2018 ... Cheese makers use starter cultures to control this ripening process. The same cultures are used for cow, goat and sheep milk. Some cultures can ...",https://cheesemaking.com/blogs/learn/faq-cheese-making-cultures
Cheese+Cultures,Digestive Health: 10 Probiotic Foods That Help Digestion,"Oct 25, 2017 ... Choose Yogurt with Live Cultures. Yogurt is a well-known food source of probiotics, beneficial bacteria that promote health.",https://www.onhealth.com/content/1/probiotic_foods
Cheese+Cultures,the word on cheese - culture,"Feb 19, 2018 ... ... they're thought to be especially good for gut health. Probiotics are most effective in natural foods. So, does cheese have probiotics?",https://culturecheesemag.com/cheese-iq/ask-the-monger/ask-the-monger-does-cheese-have-probiotics/
Cheese+Cultures,Survival of potential probiotic lactobacilli used as adjunct cultures on ...,"Jul 3, 2017 ... ... used as adjunct cultures on Pecorino Siciliano cheese ripening and passage through the gastrointestinal tract of healthy volunteers.",https://pubmed.ncbi.nlm.nih.gov/28458191/
Cheese+Cultures,11 Probiotic Foods for Gut Health That Aren't Yogurt,"Jul 16, 2019 ... Well, there are actually tons of other delicious, gut-healthy foods with probiotics you can add to your ... good culture cottage cheese.",https://www.eatthis.com/probiotic-products/
Cheese+Cultures,DuPont Nutrition & Health Introduces CHOOZIT® SWIFT 600 and ...,"Apr 4, 2018 ... This range of starter cultures provides a solution for high-volume industrial pizza cheese and pasta filata makers looking to increase ...",https://www.dupontnutritionandbiosciences.com/news/dupont-nutrition-health-introduces-choozitr-swift-600-and-choozitr-ameri-flex-cheese-cultures.html
Cheese+Cultures,DuPont Nutrition & Health launches new cheese cultures,"Apr 6, 2018 ... The new starter cultures can be seen in action in pizza cheeses and other food demos at the International Cheese Technology Exposition in ...",https://www.dairyreporter.com/Article/2018/04/06/DuPont-Nutrition-Health-launches-new-cheese-cultures
Cheese+Cultures,Old Europe Cheese Cultures: France,"And though the U.K. is not known for a tradition of healthy eating, with a diet rich in red meat and fried food, British people consume about half as much ...",https://oldeuropecheese.com/blog/old-europe-cheese-cultures-france/
Cheese+Cultures,good culture: ridiculously good,"Looking for ridiculously good, gut-friendly cultured dairy made with real, simple ingredients? Look no further. Our cottage cheese and sour cream are made ...",https://www.goodculture.com/
Maltodextrin,Maltodextrin: What Is It and Is It Safe?,"Maltodextrin is high on the glycemic index (GI), meaning that it can cause a spike in your blood sugar. It's safe to consume in very small amounts, but those ...",https://www.healthline.com/health/food-nutrition/is-maltodextrin-bad-for-me
Maltodextrin,"Maltodextrin: What it is, dangers, and substitutes",People use maltodextrin as an artificial food additive or a carbohydrate supplement to boost energy levels and performance. Experts consider ...,https://www.medicalnewstoday.com/articles/322426
Maltodextrin,What Is Maltodextrin?,"Experts consider maltodextrin a safe product for consumption, but it may carry some risks. If you have diabetes or ...",https://www.webmd.com/diet/what-is-maltodextrin
Maltodextrin,"What is Maltodextrin, and Is It Bad for You?","Dec 11, 2020 ... Blood sugars: Maltodextrin has a high glycemic index, which can cause your blood sugar to spike and be highly dangerous for people with diabetes ...",https://www.medicinenet.com/what_is_maltodextrin_and_is_it_bad_for_you/article.htm
Maltodextrin,Is Maltodextrin Safe? – Possible Side Effects of Maltodextrin – Living ...,"Jan 29, 2021 ... Although maltodextrin is deemed safe by the U.S. Food and Drug Administration (FDA), Cleveland Clinic researchers found that maltodextrin alters ...",https://www.mdvip.com/about-mdvip/blog/read-your-food-labels-watch-out-maltodextrin
Maltodextrin,"What Is Maltodextrin: Risks, Benefits, Uses and More | Livestrong.com","Sep 7, 2021 ... Maltodextrin is generally considered safe and more research is needed to confirm any negative health impacts. However, it is often in processed ...",https://www.livestrong.com/article/502241-the-risks-of-maltodextrin/
Maltodextrin,What is maltodextrin and is it safe?,People use maltodextrin as an artificial food additive or a carbohydrate supplement to boost energy levels and performance. Experts consider it to be safe for ...,https://www.hcmsonline.org/resources/news/295-what-is-maltodextrin-and-is-it-safe
Maltodextrin,"Nutrition, Health, and Regulatory Aspects of Digestible Maltodextrins","Feb 12, 2015 ... MDs are considered to be a good source of energy since glucose obtained from its digestion is readily absorbed in the small intestine and ...",https://www.ncbi.nlm.nih.gov/pmc/articles/PMC4940893/
Maltodextrin,"Maltodextrin: Dangers, Substitutes, Side Effects, and Benefits","Jul 25, 2019 ... Maltodextrin is considered generally safe to eat by the FDA. In fact, maltodextrins are also produced in the intestine when we digest starchy ...",https://greatist.com/health/maltodextrin-dangers
Maltodextrin,The Truth about Maltodextrin that Health Gurus don't want you to know.,"Apr 5, 2019 ... The data suggest that the continuous ingestion of 15–30 grams per day of resistant maltodextrin significantly improves glucose and lipid ...",https://paleofoundation.com/maltodextrin-is-toxic/
Maltodextrin,What is Maltodextrin and is it bad for you?,"The consumption of maltodextrin has similar side effects and health risks as most food additives but, as with most additives these side effects are very ...",https://www.justvitamins.co.uk/blog/what-is-maltodextrin-and-what-does-it-do-to-the-body/
Maltodextrin,What Is Maltodextrin and Is It Bad for You? What 30 Studies Say ...,"Being the health-conscious consumer you are, you peek at the nutrition labels of several of the ...",https://legionathletics.com/what-is-maltodextrin/
Maltodextrin,What Is Maltodextrin? | LoveToKnow,"When it comes down to it, maltodextrin is a safe ingredient for celiac patients and gluten-intolerant individuals, according to Celiac.com. If you have concerns ...",https://gluten.lovetoknow.com/What_Is_Maltodextrin
Maltodextrin,Nutrition Archive - Dr. Axe,"Articles about nutrition, diets, foods, herbs, supplements, vitamins and more, often including the health benefits of the chosen topic.",https://draxe.com/nutrition/
Maltodextrin,What Is Organic Maltodextrin And What Are The Alternatives?,"Feb 13, 2020 ... Because organic maltodextrin does not contain any nutritional value, it can contribute to the growth of harmful bacteria in our gut. The gut is ...",https://thewellnessconnection.com/organic-maltodextrin/
Maltodextrin,Is Maltodextrin Good Or Bad? | 2021 Ingredient Guide For Health ...,"See the impact maltodextrin has on health, environment, animals, laborers. Is maltodextrin vegan? Is maltodextrin sustainable? Are there labor concerns?",https://healabel.com/m-ingredients/maltodextrin
Maltodextrin,What Is Maltodextrin? | Holland & Barrett,"Mar 5, 2021 ... As a result, this means there's a high probability of it impacting blood sugar levels. What's more, maltodextrin is mainly found in processed ...",https://www.hollandandbarrett.com/the-health-hub/food-drink/food/what-is-maltodextrin/
Maltodextrin,BEWARE - Maltodextrin What Are The Dangers & Where Is It Added?,"Feb 19, 2019 ... When people begin a new diet particularly low-carb diets like Keto, Atkins, and Paleo they'll be replacing old foods for new healthy sugar-free ...",https://www.myketokitchen.com/keto-resources/maltodextrin-dangers-added/
Maltodextrin,Digestion Resistant Maltodextrin – Fiber Facts,"Jan 23, 2017 ... DRM has the potential to reduce peak postprandial blood glucose and insulin levels that are within the normal range in healthy individuals.",https://www.fiberfacts.org/consumer_drm/
Maltodextrin,"In healthy adults, resistant maltodextrin produces a greater change ...","Dietary fiber stimulates the growth of potentially beneficial bacteria (eg, bifidobacteria), yet most Americans do not meet daily fiber recommendations.",https://pubmed.ncbi.nlm.nih.gov/30527258/
Whey+Protein+Concentrate,Whey Protein 101: The Ultimate Beginner's Guide,"Jun 29, 2018 ... Whey protein is an exceptionally healthy way to add more protein to your diet. It's a quality protein source that is absorbed and utilized ...",https://www.healthline.com/nutrition/whey-protein-101
Whey+Protein+Concentrate,"Whey protein: Health benefits, side effects, and dangers",3 days ago ... Whey protein supplementation along with resistance exercise can help improve muscle protein synthesis and promote the growth of lean tissue mass ...,https://www.medicalnewstoday.com/articles/263371
Whey+Protein+Concentrate,10 Evidence-Based Health Benefits of Whey Protein,"Jun 12, 2017 ... There are three main types of whey protein powder, concentrate (WPC), ... of blood sugar into cells, keeping it within healthy limits. Whey ...",https://www.healthline.com/nutrition/10-health-benefits-of-whey-protein
Whey+Protein+Concentrate,Effect of administration of fermented milk containing whey protein ...,Effect of administration of fermented milk containing whey protein concentrate to rats and healthy men on serum lipids and blood pressure. J Dairy Sci.,https://pubmed.ncbi.nlm.nih.gov/10714858/
Whey+Protein+Concentrate,What is Whey Protein Concentrate?,What is whey protein concentrate? And is it a healthy source of protein? Let's dig in before gulping down.,https://shop.ora.organic/blogs/news/what-is-whey-protein-concentrate
Whey+Protein+Concentrate,"WHEY PROTEIN: Overview, Uses, Side Effects, Precautions ...","Learn more about WHEY PROTEIN uses, effectiveness, possible side effects, interactions, ... OTHER NAME(S): Bovine Whey Protein Concentrate, Concent .",https://www.webmd.com/vitamins/ai/ingredientmono-833/whey-protein
Whey+Protein+Concentrate,Whey protein - Mayo Clinic,"Safety and side effects ... When taken in appropriate amounts, whey protein appears to be safe. Some research suggests that whey protein might cause ...",https://www.mayoclinic.org/drugs-supplements-whey-protein/art-20363344
Whey+Protein+Concentrate,Whey and Whey Isolate: What's The Difference?,"Jun 21, 2021 ... Isolate. Whey is processed to reduce its fat and lactose content, leaving mainly protein. Whey protein isolate may be better for people who have ...",https://www.webmd.com/diet/difference-whey-and-whey-isolate
Whey+Protein+Concentrate,Whey Protein Isolate vs Concentrate: A Complete Guide to Whey ...,"Because it spends less time in the filtering process, whey protein concentrate has higher levels of carbohydrates (lactose - sugar) and fat than whey protein ...",https://agnroots.com/blogs/articles-info/whey-protein-concentrate-vs-whey-protein-isolate
Whey+Protein+Concentrate,The hidden dangers of protein powders - Harvard Health,"Adding protein powder to a glass of milk or a smoothie may seem like a simple way to boost your health. After, all, protein is essential for building and ...",https://www.health.harvard.edu/staying-healthy/the-hidden-dangers-of-protein-powders
Whey+Protein+Concentrate,Whey Protein: Health Benefits and Potential Side Effects ...,"Jan 4, 2021 ... Benefits of whey protein · Muscle building: Muscles love protein, especially complete proteins like whey. · Wound healing: The amino acids in whey ...",https://health.clevelandclinic.org/is-whey-protein-good-for-you/
Whey+Protein+Concentrate,What Happens To Your Body When You Eat Whey Protein Powder ...,"Apr 13, 2021 ... Whey protein powder has a high concentration of branched-chain amino acids (BCAA): amino acids that promote muscle recovery and synthesis. In ...",https://www.eatthis.com/what-happens-to-your-body-when-you-eat-whey-protein-powder/
Whey+Protein+Concentrate,What is Whey Protein Concentrate? + Benefits and Uses,"Jan 26, 2020 ... Whey contains precious enzymes and cofactors that increase glutathione, your body's strongest antioxidant. Glutathione protects your cells from ...",https://naturalforce.com/blogs/nutrition/what-is-whey-protein-concentrate
Whey+Protein+Concentrate,Whey Protein Isolate vs. Concentrate: Which is better? | Gainful,"For those on a diet, whey protein isolate has slightly lower carbohydrate and fat content. On the other hand, if you're looking for the best tasting form of ...",https://www.gainful.com/blog/protein-powder/whey-protein-isolate-or-concentrate/
Whey+Protein+Concentrate,The Best Protein Powders of 2019 (and the Worst) | Eat This Not That,"Aug 22, 2019 ... While a whey protein concentrate has a lower percentage of ... your gut healthy, but when they're combined with high-quality whey protein, ...",https://www.eatthis.com/protein-powders/
Whey+Protein+Concentrate,11 Best Whey Protein Powders For Men 2021 - Whey For Muscle Gain,"Sep 23, 2021 ... That's not just because whey protein powder tastes great, is widely available (heck, even grocery stores carry the stuff now), and goes down ...",https://www.menshealth.com/nutrition/g19547347/best-whey-powder-review/
Whey+Protein+Concentrate,Whey protein isolate attenuates strength decline after eccentrically ...,"Sep 22, 2010 ... Seventeen healthy, untrained males (23 ± 5 yrs, 180 ± 6 cm, 80 ± 11 kg) volunteered for this study. Descriptive characteristics of the ...",https://jissn.biomedcentral.com/articles/10.1186/1550-2783-7-30
Whey+Protein+Concentrate,Here's Why You Should Switch to Grass-Fed Whey Protein Powder,"Dec 1, 2019 ... If you're even moderately interested in living a healthy lifestyle, the supplement is likely a core tenet of your daily diet. You throw it in a ...",https://www.eatthis.com/grass-fed-whey-protein-powder/
Whey+Protein+Concentrate,The Difference Between Whey Protein Concentrate and Isolate ...,"Oct 28, 2020 ... Whey protein isolate contains more protein and fewer carbs and fats ... And if you're just choosing whey protein concentrate as a healthy ...",https://www.popsugar.com/fitness/whey-protein-concentrate-vs-isolate-47823146
Whey+Protein+Concentrate,"32 Best Protein Powders in 2021, According to Dietitians","Dec 14, 2020 ... In fact, whey is the most effective powder at building muscle. ... will feature “hemp protein,” which retains hemp's healthy fiber and fats, ...",https://www.prevention.com/food-nutrition/healthy-eating/a20440938/best-protein-powders-for-smoothies/
Monosodium+Glutamate,Monosodium glutamate (MSG): Is it harmful? - Mayo Clinic,"Monosodium glutamate (MSG) is a flavor enhancer commonly added to Chinese food, canned vegetables, soups and processed meats. The Food and Drug ...",https://www.mayoclinic.org/healthy-lifestyle/nutrition-and-healthy-eating/expert-answers/monosodium-glutamate/faq-20058196
Monosodium+Glutamate,MSG (Monosodium Glutamate): Good or Bad?,"Nov 19, 2018 ... Depending on who you ask, MSG is either perfectly safe or a dangerous neurotoxin. The truth lies somewhere in between. Evidence indicates that ...",https://www.healthline.com/nutrition/msg-good-or-bad
Monosodium+Glutamate,Extensive use of monosodium glutamate: A threat to public health?,"These toxic effects include CNS disorder, obesity, disruptions in adipose tissue physiology, hepatic damage, CRS and reproductive malfunctions. These threats ...",https://www.ncbi.nlm.nih.gov/pmc/articles/PMC5938543/
Monosodium+Glutamate,Why Is MSG Bad For Your Health?,"Nov 30, 2020 ... One of the findings concluded that MSG is safe, although in some, MSG, when consumed above 3 g, may induce symptoms such as headache or ...",https://www.medicinenet.com/why_is_msg_bad_for_your_health/article.htm
Monosodium+Glutamate,Health Debunked: Is MSG Really Bad for You? - GoodRx,"Jun 23, 2021 ... While MSG is generally recognized as safe, some research suggests that consuming the additive in excessive doses could be harmful. According to ...",https://www.goodrx.com/well-being/diet-nutrition/is-msg-bad-for-you
Monosodium+Glutamate,Is MSG Bad For You? Here's the Surprising Truth.,"Jun 18, 2019 ... So in the 1990s, the FDA asked an independent scientific group to investigate. The group concluded that MSG is safe, though they said some ...",https://www.realmomnutrition.com/is-msg-safe/
Monosodium+Glutamate,Is MSG as bad as it's made out to be? - BBC Future,"Nov 6, 2015 ... Washington University researcher Dr John W. Olney found that injecting enormous doses of monosodium glutamate under the skin of newborn mice led ...",https://www.bbc.com/future/article/20151106-is-msg-as-bad-as-its-made-out-to-be
Monosodium+Glutamate,"The truth about MSG and health, according to experts","Nov 4, 2020 ... Despite the extensive number of symptoms reportedly linked to MSG, the FDA says that MSG is safe. Other health authorities including the World ...",https://www.today.com/health/msg-bad-you-truth-about-msg-according-experts-t197207
Monosodium+Glutamate,Scientists Have Known MSG Is Safe for Decades. Why Don't Most ...,"Oct 10, 2018 ... MSG: You probably know it as that terrible-for-you substance in Chinese and packaged foods that many products proudly proclaim they're made ...",https://health.usnews.com/health-news/blogs/eat-run/articles/2018-10-10/scientists-have-known-msg-is-safe-for-decades-why-dont-most-americans
Monosodium+Glutamate,"MSG: Is it harmful? Risks, uses, and more",The FDATrusted Source classifies MSG as generally safe. There is not enough evidence to support a link between MSG consumption and the adverse reactions that ...,https://www.medicalnewstoday.com/articles/is-msg-bad-for-you
Monosodium+Glutamate,Is MSG Bad for Your Health?,"Oct 2, 2014 ... “Anything consumed in excess is no good,” says Lee. “Everything consumed in excess could be toxic, including MSG. However, that being said, I ...",https://www.sciencefriday.com/articles/is-msg-bad-for-your-health/
Monosodium+Glutamate,"Is MSG Bad for You? No—Here's the Truth, According to an Expert","Jan 23, 2019 ... His team's conclusion: “Findings from our data and other human studies provide important evidence that MSG in the food supply presents no hazard ...",https://www.menshealth.com/nutrition/a26006305/msg-not-bad-for-you/
Monosodium+Glutamate,Prolonged Exposure to Monosodium Glutamate in Healthy Young ...,"Jun 1, 2018 ... Our results highlight that a month-long diet high in umami stimuli attenuates perceived umami taste and appetite for savory foods in a young ...",https://pubmed.ncbi.nlm.nih.gov/29796671/
Monosodium+Glutamate,Monosodium glutamate - Wikipedia,"Monosodium glutamate (MSG), also known as sodium glutamate, is the sodium salt of glutamic ... ""MSG might even promote healthy eating, [food scientist Steve Witherly] ...",https://en.wikipedia.org/wiki/Monosodium_glutamate
Monosodium+Glutamate,Is MSG Bad for You? the Truth About Monosodium Glutamate,"Apr 21, 2021 ... MSG is a common food additive that is generally considered safe by the FDA. · There is no scientific evidence that MSG is bad for your or can ...",https://www.insider.com/what-is-msg
Monosodium+Glutamate,10 Foods High in Glutamate and Why You Should Avoid Them,"Nov 23, 2020 ... Monosodium glutamate (MSG) is the sodium salt of glutamic acid and is a ... Even though glutamate exists naturally in the body and healthy ...",https://www.webmd.com/diet/high-glutamate-foods
Monosodium+Glutamate,Consumption of monosodium glutamate in relation to incidence of ...,"Apr 6, 2011 ... MSG consumption was positively, longitudinally associated with overweight development among apparently healthy Chinese adults.",https://pubmed.ncbi.nlm.nih.gov/21471280/
Monosodium+Glutamate,A Review of the Alleged Health Hazards of Monosodium Glutamate ...,"May 8, 2019 ... Monosodium glutamate (MSG) is an umami substance widely used as flavor enhancer. Although it is generally recognized as being safe by food ...",https://onlinelibrary.wiley.com/doi/full/10.1111/1541-4337.12448
Monosodium+Glutamate,5 High MSG Foods to Avoid,"Oct 26, 2020 ... Therefore, the FDA requires that the ingredient is included on food labels. MSG has been said to cause a number of minor health symptoms you ...",https://www.webmd.com/diet/foods-high-in-msg
Monosodium+Glutamate,"Why Americans still avoid MSG, even though its 'health effects' have ...","Mar 20, 2018 ... In the 1990s, the FDA commissioned an independent review that found MSG only caused adverse effects in a small minority of “sensitive ...",https://www.washingtonpost.com/news/wonk/wp/2018/03/20/why-americans-still-avoid-msg-even-though-its-health-effects-have-been-debunked/
Artificial+Color+Yellow+6,Food Dyes: Harmless or Harmful?,"Jan 7, 2017 ... Artificial food dyes are responsible for the bright colors of candy, ... The most popular food dyes are Red 40, Yellow 5 and Yellow 6.",https://www.healthline.com/nutrition/food-dyes
Artificial+Color+Yellow+6,What You Need To Know About 6 Artificial Food Colors | The Healthy,"Jan 14, 2013 ... Norway and Finland have banned Yellow #6. Why? It contains the same cancer-causing compounds as Yellow #5. In addition, Yellow #6 causes tumors ...",https://www.thehealthy.com/nutrition/rainbow-risks-6-artificial-food-colors-you-need-to-know-about/
Artificial+Color+Yellow+6,"FD&C Yellow 5: What It Is, Health Effects, Cancer Risk, and More","Jul 25, 2019 ... Yellow 5 is an artificial food coloring that has been shown to have some negative side ... yellow 5; yellow 6; quinoline yellow; carmoisine ...",https://www.healthline.com/health/yellow-5
Artificial+Color+Yellow+6,DIET AND NUTRITION: The Artificial Food Dye Blues,"Red 40, Yellow 5, and Yellow 6 contain benzidene, a human and animal carcinogen ... “The FDA has repeatedly stated that these colors are safe based on the ...",https://www.ncbi.nlm.nih.gov/pmc/articles/PMC2957945/
Artificial+Color+Yellow+6,CSPI Says Food Dyes Pose Rainbow of Risks | Center for Science ...,"Jun 29, 2010 ... The three most widely used dyes, Red 40, Yellow 5, and Yellow 6, ... to color foods with real food ingredients, not toxic petrochemicals.”.",https://cspinet.org/new/201006291.html
Artificial+Color+Yellow+6,Toxicology of food dyes,"Red 3 causes cancer in animals, and there is evidence that several other dyes also are carcinogenic. Three dyes (Red 40, Yellow 5, and Yellow 6) have been ...",https://pubmed.ncbi.nlm.nih.gov/23026007/
Artificial+Color+Yellow+6,Four Incredibly Harmful Effects Artificial Dyes Have On Our Health ...,"Dec 9, 2020 ... Although artificial coloring is commonly added to food, ... artificial food colors (Blue 1, Blue 2, Red 3, Red 40, Yellow 5, & Yellow 6).",https://www.foodnerdinc.com/blogs/food-for-thought/artificial-food-coloring-no-thank-you
Artificial+Color+Yellow+6,16 Foods That Contain Chemicals & Food Dyes | Eat This Not That,"May 19, 2016 ... For example, we now know that Yellow #5 and Yellow #6 (found in ... Mills announced that they would eliminate artificial colors and flavors ...",https://www.eatthis.com/chemicals-in-food/
Artificial+Color+Yellow+6,"Food coloring is bad for us, but the FDA won't admit that.","Jul 7, 2016 ... 40 and Yellow No. 6 in the U.S. Many major food companies in the U.S. use artificial food dyes in America—while selling naturally colored or ...",https://slate.com/technology/2016/07/food-coloring-is-bad-for-us-but-the-fda-wont-admit-that.html
Artificial+Color+Yellow+6,Artificial Food Coloring: Good or Bad? | Food Network Healthy Eats ...,"Their petition includes two of the most common, Yellow 5 and Red 40, as well as Blue 1, Blue 2, Green 3, Orange B, Red 3 and Yellow 6. Internationally, the U.S. ...",https://www.foodnetwork.com/healthyeats/healthy-tips/2010/06/artificial-colors-are-they-safe
Artificial+Color+Yellow+6,Is Yellow 6 Bad For You? - Here Is Your Answer.,"Apr 28, 2016 ... Out of the numerous artificial dyes under the Federal Food Drug and Cosmetics Act (FD&C), Yellow #6 is currently considered one of the most ...",https://www.isitbadforyou.com/questions/is-yellow-6-bad-for-you
Artificial+Color+Yellow+6,Cheetos Nutrition: What All the Ingredients Mean - Thrillist,"Nov 16, 2015 ... ... whey protein concentrate, monosodium glutamate, natural and artificial flavors, lactic acid, citric acid, artificial color [yellow 6]) ...",https://www.thrillist.com/health/nation/cheetos-nutrition-what-all-the-ingredients-mean
Artificial+Color+Yellow+6,10 Unexpected Places You Might Find Food Dye | Cooking Light,"Sep 25, 2017 ... Creamy French Dressing contains the artificial color Yellow 6 while ... No matter how “healthy” cereal bars, granola bars, or energy bars ...",https://www.cookinglight.com/healthy-living/health/what-kind-of-foods-have-food-dye-unexpectedly
