A+B+Vitamin+%28folic+acid%29,Bread cofortified with folic acid and vitamin B-12 improves the folate ...,Bread cofortified with folic acid and vitamin B-12 improves the folate and vitamin B-12 status of healthy older people: a randomized controlled trial.,https://pubmed.ncbi.nlm.nih.gov/18689370/
A+B+Vitamin+%28folic+acid%29,"B Vitamins and the Brain: Mechanisms, Dose and Efficacy—A Review","Jan 28, 2016 ... B5, Pantothenic acid, Meat, whole grain cereals, broccoli, 5 ... with negative health effects associated with reduced vitamin B12 extending ...",https://www.ncbi.nlm.nih.gov/pmc/articles/PMC4772032/
A+B+Vitamin+%28folic+acid%29,Vitamin B - Better Health Channel,"Some B-group vitamins also work together in the body (for example, vitamin B12 and folate or folic acid). This means taking ...",https://www.betterhealth.vic.gov.au/health/healthyliving/vitamin-b
A+B+Vitamin+%28folic+acid%29,Folic Acid: MedlinePlus,"Jul 28, 2021 ... Folic acid is a B vitamin. It helps the body make healthy new cells. Everyone needs folic acid. For women who may get pregnant, ...",https://medlineplus.gov/folicacid.html
A+B+Vitamin+%28folic+acid%29,"Folic acid: Importance, deficiencies, and side effects","It is especially important in prenatal health. Folate, also called vitamin B-9, is a B vitamin that naturally occurs in certain foods. Folic acid is the ...",https://www.medicalnewstoday.com/articles/219853
A+B+Vitamin+%28folic+acid%29,Vitamin B-12 Deficiency Anemia | Cedars-Sinai,This type of anemia is usually found during a health exam through a routine ... Treatment may include vitamin B-12 shots (injections) or folic acid pills.,https://www.cedars-sinai.org/health-library/diseases-and-conditions/a/anemia-of-b12-deficiency.html
A+B+Vitamin+%28folic+acid%29,"Vitamin B Complex: Benefits, Side Effects, Dosage, Foods, and More","Feb 16, 2021 ... Vitamin B complex is a product that's composed of eight B vitamins: B-1 (thiamine), B-2 (riboflavin), B-3 (niacin), B-5, (pantothenic acid), ...",https://www.healthline.com/health/food-nutrition/vitamin-b-complex
A+B+Vitamin+%28folic+acid%29,Vitamin B Test: MedlinePlus Medical Test,"Dec 15, 2020 ... A deficiency in any of the B vitamins can cause serious health problems. ... B1, thiamine; B2, riboflavin; B3, niacin; B5, pantothenic acid ...",https://medlineplus.gov/lab-tests/vitamin-b-test/
A+B+Vitamin+%28folic+acid%29,Vitamins (for Kids) - Nemours Kidshealth,"B vitamins in whole grains help your body make energy from food. ... niacin, B6 (pyridoxine), folic acid, B12 (cobalamine), biotin, and pantothenic acid.",https://kidshealth.org/en/kids/vitamin.html
Vitamin+B12,Vitamin B12 - Consumer,Vitamin B12 is a nutrient that helps keep your body's blood and nerve cells healthy and helps make ...,https://ods.od.nih.gov/factsheets/VitaminB12-Consumer/
Vitamin+B12,"9 Health Benefits of Vitamin B12, Based on Science","Jun 14, 2018 ... Vitamin B12 plays a vital role in helping your body produce red blood cells. Low vitamin B12 levels cause a reduction in red blood cell ...",https://www.healthline.com/nutrition/vitamin-b12-benefits
Vitamin+B12,"Vitamin B12 Deficiency: Causes, Symptoms, and Treatment","May 3, 2021 ... Vitamin B12 is essential for good health, but some people may not be getting enough. WebMD tells you about symptoms of a vitamin B12 ...",https://www.webmd.com/diet/vitamin-b12-deficiency-symptoms-causes
Vitamin+B12,Vitamin B-12 - Mayo Clinic,"When taken at appropriate doses, vitamin B-12 supplements are generally considered safe. While the recommended daily amount of vitamin B-12 for adults is 2.4 ...",https://www.mayoclinic.org/drugs-supplements-vitamin-b12/art-20363663
Vitamin+B12,"VITAMIN B12: Overview, Uses, Side Effects, Precautions ...","Vitamin B12 is required for the proper function and development of the brain, nerves, blood cells, and many other parts of the body.",https://www.webmd.com/vitamins/ai/ingredientmono-926/vitamin-b12
Vitamin+B12,"Vitamin B-12: Functions, deficiency, and sources",Plant-sourced foods do not have enough cobalamin to guarantee long-term health. People with pernicious anemia may lack vitamin B-12. Pernicious anemia is an ...,https://www.medicalnewstoday.com/articles/219822
Vitamin+B12,"Vitamin B12 deficiency can be sneaky, harmful - Harvard Health","Jan 10, 2013 ... The human body needs vitamin B12 to make red blood cells, nerves, DNA, and carry out other functions. The average adult should get 2.4 ...",https://www.health.harvard.edu/blog/vitamin-b12-deficiency-can-be-sneaky-harmful-201301105780
Vitamin+B12,Vitamin B12 in Health and Disease,Increased risk of frailty and disability has been associated with poor B vitamin status. Subjects with vitamins B12 and B6 in the lowest quintiles and subjects ...,https://www.ncbi.nlm.nih.gov/pmc/articles/PMC3257642/
Vitamin+B12,Vitamin B12 Deficiency Anemia | Johns Hopkins Medicine,"Vitamin B12 deficiency anemia is a condition in which your body does not have enough healthy red blood cells, due to a lack (deficiency) of vitamin B12.",https://www.hopkinsmedicine.org/health/conditions-and-diseases/vitamin-b12-deficiency-anemia
Vitamin+B12,Vitamin B12 | The Nutrition Source | Harvard T.H. Chan School of ...,"Vitamin B12 and Health · Fish, shellfish · Liver · Red meat · Eggs · Poultry · Dairy products such as milk, cheese, and yogurt · Fortified nutritional yeast · Fortified ...",https://www.hsph.harvard.edu/nutritionsource/vitamin-b12/
Vitamin+B12,Vitamins and minerals - B vitamins and folic acid - NHS,Vitamin B12 is involved in helping the body: make red blood cells and keeping the nervous system healthy; release energy from food; use folate. A lack of ...,https://www.nhs.uk/conditions/vitamins-and-minerals/vitamin-b/
Vitamin+B12,"Vitamin B12: Uses, Benefits, Food Sources",Vitamin B12 is an important factor in helping the body produce healthy red blood cells. When the body is deficient in or has low levels of ...,https://www.verywellhealth.com/vitamin-b12-5083479
Vitamin+B12,Vitamin B12 level Information | Mount Sinai - New York,"Normal values are 160 to 950 picograms per milliliter (pg/mL), or 118 to 701 picomoles per liter (pmol/L). Normal value ranges may vary slightly among different ...",https://www.mountsinai.org/health-library/tests/vitamin-b12-level
Vitamin+B12,What Every Vegan Should Know About Vitamin B12 | The Vegan ...,"It is very important that all vegans ensure they have an adequate intake of B12, from fortified foods or supplements. This will benefit our health and help to ...",https://www.vegansociety.com/resources/nutrition-and-health/nutrients/vitamin-b12/what-every-vegan-should-know-about-vitamin-b12
Vitamin+B12,Quick Nutrition Check for Vitamin B12 | HealthLink BC,"Your body needs vitamin B12 to help keep your nerve and red blood cells healthy and to make DNA, the genetic material in your cells.",https://www.healthlinkbc.ca/healthy-eating/vitamin-b12
Vitamin+B12,Vitamin B12 (Cyanocobalamin Injection) - Everyday Health,"Nov 16, 2020 ... This medicine is given to treat or prevent a vitamin B12 deficiency in people with pernicious anemia or other medical conditions, both in an ...",https://www.everydayhealth.com/drugs/vitamin-b-12
Vitamin+B12,Vitamin B12 and Folate - Lab Tests Online,"Mar 24, 2021 ... Order your at-home health test online. A convenient, affordable, and discreet way of getting accurate test results quickly. Order ...",https://labtestsonline.org/tests/vitamin-b12-and-folate
Vitamin+B12,"Vitamin B12 Intake From Animal Foods, Biomarkers, and ... - Frontiers",1 will elaborate on a potential role of high folate and low vitamin B12 status in health. Uptake ...,https://www.frontiersin.org/articles/10.3389/fnut.2019.00093/full
Vitamin+B12,Vitamin B12 | Breastfeeding | CDC,Infants need vitamin B12 for supporting brain development and producing healthy red blood cells. Infants who do not get adequate vitamin B12 can become ...,https://www.cdc.gov/breastfeeding/breastfeeding-special-circumstances/diet-and-micronutrients/vitamin-b12.html
Vitamin+B12,Folic acid with or without vitamin B12 for the prevention and ...,"Oct 8, 2008 ... Folic acid with or without vitamin B12 for the prevention and treatment of healthy elderly and demented people. Cochrane Database Syst Rev.",https://pubmed.ncbi.nlm.nih.gov/18843658/
Vitamin+D3,3 Surprising Benefits of Vitamin D,"Perhaps the most vital are regulating the absorption of calcium and phosphorus, and facilitating normal immune system function. Getting a sufficient amount of ...",https://www.healthline.com/health/food-nutrition/benefits-vitamin-d
Vitamin+D3,Vitamin D - Health Professional Fact Sheet,"Aug 17, 2021 ... Without sufficient vitamin D, bones can become thin, brittle, or misshapen. Vitamin D sufficiency prevents rickets in children and osteomalacia ...",https://ods.od.nih.gov/factsheets/VitaminD-HealthProfessional/
Vitamin+D3,Vitamin D toxicity: What if you get too much? - Mayo Clinic,"Understand the risks of too much vitamin D, including a toxic reaction. ... Nutrition and healthy eating. Sections. Basics · Nutrition basics · Healthy ...",https://www.mayoclinic.org/healthy-lifestyle/nutrition-and-healthy-eating/expert-answers/vitamin-d-toxicity/faq-20058108
Vitamin+D3,Taking too much vitamin D can cloud its benefits and create health ...,"Some people are overdoing it in search of better health. vitamin D supplements. Vitamin D is having its day in the sun. In recent years, research has ...",https://www.health.harvard.edu/staying-healthy/taking-too-much-vitamin-d-can-cloud-its-benefits-and-create-health-risks
Vitamin+D3,Vitamin D - Mayo Clinic,"Feb 9, 2021 ... Learn how vitamin D affects bone health and other health conditions, and discover the possible side effects of taking too much of this ...",https://www.mayoclinic.org/drugs-supplements-vitamin-d/art-20363792
Vitamin+D3,Vitamin D: Vital Role in Your Health,"""Activated vitamin D is one of the most potent inhibitors of cancer cell growth,"" says Michael F. Holick, PhD, MD, who heads the Vitamin D, Skin, and Bone ...",https://www.webmd.com/food-recipes/features/vitamin-d-vital-role-in-your-health
Vitamin+D3,"Vitamin D: Benefits, deficiency, sources, and dosage","Benefits · promoting healthy bones and teeth · supporting immune, brain, and nervous system health · regulating insulin levels and supporting diabetes management ...",https://www.medicalnewstoday.com/articles/161618
Vitamin+D3,"Vitamin D Deficiency: 6 Causes, Common Symptoms & Health Risks","Jul 28, 2020 ... Vitamin D is essential for healthy bones, and a lack of it can lead to health problems, including cardiovascular disease.",https://www.webmd.com/diet/guide/vitamin-d-deficiency
Vitamin+D3,Vitamin D | The Nutrition Source | Harvard T.H. Chan School of ...,"It is a fat-soluble vitamin that has long been known to help the body absorb and retain calcium and phosphorus; both are critical for building bone. Also, ...",https://www.hsph.harvard.edu/nutritionsource/vitamin-d/
Vitamin+D3,"Vitamin D3: Benefits, Sources, Deficiency, and More","Vitamin D3 offers many health benefits. It is known to help strengthen bones and muscles, boost immunity, increase mood, have anti-inflammatory effects, ...",https://www.verywellhealth.com/vitamin-d3-5082500
Vitamin+D3,Vitamin D Deficiency: Symptoms & Treatment,"Oct 16, 2019 ... Vitamin D deficiency can cause symptoms of fatigue and bone pain that can lead to health risks including osteoporosis and depression.",https://my.clevelandclinic.org/health/articles/15050-vitamin-d--vitamin-d-deficiency
Vitamin+D3,Vitamins and minerals - Vitamin D - NHS,"These nutrients are needed to keep bones, teeth and muscles healthy. A lack of vitamin D can lead to bone deformities such as rickets in children, and bone pain ...",https://www.nhs.uk/conditions/vitamins-and-minerals/vitamin-d/
Vitamin+D3,Vitamin D Health Benefits: What It Can and Can't Do for Your Body ...,"May 7, 2020 ... The Takeaway on Vitamin D and Your Health ... Vitamin D is an essential nutrient that can help fortify bones and keep them strong while also ...",https://www.everydayhealth.com/vitamin-d/vitamin-d-health-benefits-what-it-can-cant-your-body/
Vitamin+D3,"Calcium/Vitamin D Requirements, Recommended Foods ...","What is Calcium and What Does it Do? Cheese, milk, fish, almonds, and other bone-healthy foods. A calcium-rich diet (including dairy, nuts, ...",https://www.nof.org/patients/treatment/calciumvitamin-d/
Vitamin+D3,How to get vitamin D from sunlight - NHS,"Vitamin D is essential for healthy bones, and we get most of ours from sunlight exposure. Find out how to get enough without risking sun damage.",https://www.nhs.uk/live-well/healthy-body/how-to-get-vitamin-d-from-sunlight/
Vitamin+D3,DO-HEALTH: Vitamin D3 - Omega-3 - Home exercise - Healthy ...,"Aug 26, 2020 ... DO-HEALTH is a multi-center clinical trial among 2157 ... DO-HEALTH: Vitamin D3 - Omega-3 - Home exercise - Healthy aging and longevity ...",https://pubmed.ncbi.nlm.nih.gov/32858228/
Vitamin+D3,Vitamin D and the Immune System,The classical actions of vitamin D are to promote calcium homeostasis and to promote bone health. Vitamin D enhances absorption of calcium in the small ...,https://www.ncbi.nlm.nih.gov/pmc/articles/PMC3166406/
Vitamin+D3,How Does Vitamin D Affect Women's Health? | Johns Hopkins ...,It may not be low vitamin D levels causing the heart disease. Will a Daily Vitamin Help Keep Your Heart Healthy?,https://www.hopkinsmedicine.org/health/wellness-and-prevention/how-does-vitamin-d-affect-womens-health
Vitamin+D3,Vitamin D for Good Bone Health - OrthoInfo - AAOS,"Vitamin D is necessary for strong bones and muscles. Without Vitamin D, our bodies cannot effectively absorb calcium, which is essential to good bone health ...",https://orthoinfo.aaos.org/en/staying-healthy/vitamin-d-for-good-bone-health/
Vitamin+D3,9 Vitamin D Benefits You Should Know—and How to Get More in ...,"Jun 25, 2020 ... Because vitamin D helps our body absorb calcium, it plays a crucial role in supporting oral health, lowering the risk of tooth decay and gum ...",https://www.health.com/nutrition/vitamins-supplements/vitamin-d-benefits
wheat+flour,5 of the Healthiest Flours for Every Purpose,"Jul 27, 2020 ... Thus, whole wheat flour is widely considered healthier. It's a good source of protein, fiber, and a variety of vitamins and minerals. As it ...",https://www.healthline.com/nutrition/healthiest-flour
wheat+flour,Is Wheat Flour Healthy? (6 reasons to avoid wheat flour) - The Lyons ...,"Mar 22, 2021 ... Gluten is inflammatory. · Flour made from grains spikes blood sugar significantly. · Wheat flour is grown and commercially modified in unhealthy ...",https://www.thelyonsshare.org/2021/03/22/is-wheat-flour-healthy-6-reasons-to-avoid-wheat-flour/
wheat+flour,Wheat Flour vs. White Flour: Which is Better for Your Health ...,"In conclusion, don't be duped by healthy claims made by food companies that label their wheat flour products as healthier than white flour. If you're trying to ...",https://miraclenoodle.com/blogs/miraclenoodle-blog/105465478-wheat-flour-vs-white-flour-which-is-better-for-your-health
wheat+flour,Healthy Facts About Whole-Wheat Flour Vs. White,"Whole-wheat flour provides a nutritional advantage over some white flours due to its vitamin content. Whole-wheat flour contains several vitamins, including ...",https://healthyeating.sfgate.com/healthy-wholewheat-flour-vs-white-3305.html
wheat+flour,Whole Wheat Flour vs White Flour: What Should You Choose?,"Jun 8, 2020 ... Health Effects. Research by the French National Institute for Agriculture, Food and Environment, found that whole-grain cereals like whole wheat ...",https://www.24mantra.com/blogs/organic-lifestyle/whole-wheat-flour-vs-white-flour-what-should-you-choose/
wheat+flour,Wheat flour bad for health? | Health - Hindustan Times,"Feb 23, 2013 ... Though foods made from wheat flour are bad for health, they are addictive and cannot be given up easily. Therefore, they should be eaten ...",https://www.hindustantimes.com/health-and-fitness/wheat-flour-bad-for-health/story-mqpGAYJuNIBztcSoC43e8N.html
wheat+flour,"14 ""Healthy"" Foods That Are Actually Bad For You","Jul 25, 2012 ... These days, you can get Whole Wheat Lucky Charms – do you really think that makes them healthy? If it isn't 100% whole wheat, bread can contain ...",https://www.forbes.com/sites/jennifercohen/2012/07/25/14-healthy-foods-that-are-actually-bad-for-you/
wheat+flour,The Whole Truth About Whole Grains,The Nurses' Health Study found that women who ate more than 5 grams of fiber from whole-grain cereals ... Brown rice; Oats; Whole-wheat flour; Rye flour ...,https://www.webmd.com/food-recipes/features/the-whole-truth-about-whole-grains
wheat+flour,Whole Wheat Flour vs. White Flour,"Jun 8, 2020 ... Whole wheat flour is also rich in vitamins B-1, B-3, and B-5, along with riboflavin and folate. It also has more iron, calcium, protein, and ...",https://www.thespruceeats.com/whole-wheat-flour-vs-white-flour-2238373
wheat+flour,What's Wrong with Whole Wheat? - DrWeil.com,"In your book “Healthy Aging,” you recommend eating whole grains but not whole-wheat flour products. Why? Andrew Weil, M.D. | November 29, 2006.",https://www.drweil.com/diet-nutrition/nutrition/whats-wrong-with-whole-wheat/
wheat+flour,Is wheat flour good for your health? - Quora,"Food is good for your health. Wheat and whole grains have more nutrients that provide benefits than more processed flours. Obviously, if someone has an ...",https://www.quora.com/Is-wheat-flour-good-for-your-health
wheat+flour,A Guide to Whole Wheat and Whole Grain Flours | Forks Over Knives,"May 22, 2020 ... Other Types of Whole Grain Flours · Amaranth Flour (Gluten-Free) · Barley Flour (Contains Gluten) · Brown Rice Flour (Gluten-Free) · Buckwheat Flour ...",https://www.forksoverknives.com/how-tos/types-whole-grain-flour-guide-whole-wheat-flours/
wheat+flour,6 of the Healthiest Flours to Use | EatingWell,"Jan 31, 2020 ... Whole-wheat flour is much heartier than all-purpose, and produces denser baked goods with more robust flavor. Milled from wheat berries with the ...",https://www.eatingwell.com/article/7595251/the-healthiest-flours-to-use/
wheat+flour,Noodles Made from High Amylose Wheat Flour Attenuate ...,Noodles Made from High Amylose Wheat Flour Attenuate Postprandial Glycaemia in Healthy Adults. Nutrients. 2020 Jul 22;12(8):2171. doi: 10.3390/nu12082171.,https://pubmed.ncbi.nlm.nih.gov/32707905/
wheat+flour,White whole-wheat bread: Is it nutritious? - Mayo Clinic,White whole-wheat bread may make it easier to add whole grains to your diet. ... Nutrition and healthy eating. Sections.,https://www.mayoclinic.org/healthy-lifestyle/nutrition-and-healthy-eating/expert-answers/whole-wheat-bread/faq-20057999
wheat+flour,Gluten: A Benefit or Harm to the Body? | The Nutrition Source ...,"Many studies have linked whole grain consumption with improved health outcomes. ... made with processed unfortified rice, tapioca, corn, or potato flours.",https://www.hsph.harvard.edu/nutritionsource/gluten/
wheat+flour,10 Healthier Alternative Flours to Try | Everyday Health,"Dec 17, 2020 ... One of the standout benefits of whole-wheat flour is its fiber content — you'll get 12 g in 1 cup, according to the USDA, making it an excellent ...",https://www.everydayhealth.com/diet-nutrition/alternative-flours-to-try-in-homemade-baked-goods/
wheat+flour,Whole Grains | The Nutrition Source | Harvard T.H. Chan School of ...,"Whole grains offer a “complete package” of health benefits, ... Refining wheat creates fluffy flour that makes light, airy breads and pastries, ...",https://www.hsph.harvard.edu/nutritionsource/what-should-you-eat/whole-grains/
wheat+flour,Gluten-free? Try these delicious alternatives to wheat flour - Mayo ...,"A glossary of gluten-free flours · Amaranth flour has a nutty, slightly sweet, toasted flavor. · Arrowroot flour is a good substitute for cornstarch. · Bean flour ...",https://www.mayoclinic.org/healthy-lifestyle/nutrition-and-healthy-eating/in-depth/gluten-free-try-these-delicious-alternatives-to-wheat-flour/art-20269952
wheat+flour,Wheat flour - Wikipedia,"Wheat flour is a powder made from the grinding of wheat used for human consumption. Wheat varieties are called ""soft"" or ""weak"" if gluten content is low, ...",https://en.wikipedia.org/wiki/Wheat_flour
niacin+(Vitamin+B3),"Niacin (Vitamin B3) : Benefits, Dosage, Sources, Risks","Mar 26, 2020 ... At the low DRI doses, niacin is safe for everyone. However, at the higher amounts used to treat medical conditions, it can have ...",https://www.webmd.com/diet/supplement-guide-niacin
niacin+(Vitamin+B3),Niacin – Vitamin B3 | The Nutrition Source | Harvard T.H. Chan ...,UL: The Tolerable Upper Intake Level is the maximum daily intake unlikely to cause harmful effects on health. The UL for niacin for all adults 19+ years is 35 ...,https://www.hsph.harvard.edu/nutritionsource/niacin-vitamin-b3/
niacin+(Vitamin+B3),5 Benefits of Niacin (Vitamin B3) That You May Not Know,"Oct 5, 2018 ... Niacin (vitamin B3) is a very important nutrient for your body. It has many health benefits, along with several side effects if you take ...",https://www.healthline.com/nutrition/niacin-benefits
niacin+(Vitamin+B3),Niacin - Mayo Clinic,"Know how your body uses niacin and how this supplement might help your ... It helps keep your nervous system, digestive system and skin healthy. Niacin ...",https://www.mayoclinic.org/drugs-supplements-niacin/art-20364984
niacin+(Vitamin+B3),Niacin - Health Professional Fact Sheet,"Mar 26, 2021 ... Niacin (also known as vitamin B3) is one of the water-soluble B vitamins. Niacin is the generic name for nicotinic acid (pyridine-3-carboxylic ...",https://ods.od.nih.gov/factsheets/Niacin-HealthProfessional/
niacin+(Vitamin+B3),Vitamin B3 (Niacin) Information | Mount Sinai - New York,Learn about Vitamin B3 (Niacin) or find a doctor at Mount Sinai Health System. ... Inositol hexaniacinate; Niacin; Niacinamide; Nicotinamide; Nicotinic acid.,https://www.mountsinai.org/health-library/supplement/vitamin-b3-niacin
niacin+(Vitamin+B3),Niacin - Consumer,"Mar 22, 2021 ... Niacin (Vitamin B3) helps turn food into energy. Learn how much you need, good sources, deficiency symptoms, and health effects here.",https://ods.od.nih.gov/factsheets/Niacin-Consumer/
niacin+(Vitamin+B3),Vitamins and minerals - B vitamins and folic acid - NHS,thiamin (vitamin B1); riboflavin (vitamin B2); niacin (vitamin B3); pantothenic acid ... What does the Department of Health and Social Care advise?,https://www.nhs.uk/conditions/vitamins-and-minerals/vitamin-b/
niacin+(Vitamin+B3),"Vitamin B-3 (niacin): Deficiency symptoms, uses, and suggested intake","It helps the body to use proteins and fats, and it keeps the skin, hair, and nervous system healthy. Other possible benefits of vitamin B-3 stem from its ...",https://www.medicalnewstoday.com/articles/219593
niacin+(Vitamin+B3),Niacin (Vitamin B3): Benefits & Side Effects | Live Science,"Feb 7, 2018 ... Sources of niacin (vitamin B3) include mushrooms, cereals, eggs, meat, green vegetables ... Niacin also can play a part in improving health.",https://www.livescience.com/51825-niacin-benefits.html
niacin+(Vitamin+B3),Niacin in the Central Nervous System: An Update of Biological ...,"Feb 23, 2019 ... Niacin (also known as “vitamin B3” or “vitamin PP”) includes two vitamers ... highlights the key role of vitamin B3 in neuronal health.",https://www.ncbi.nlm.nih.gov/pmc/articles/PMC6412771/
niacin+(Vitamin+B3),7 Health Benefits of Vitamin B3 (Niacin) - NDTV Food,"Jul 6, 2018 ... It is important to consume appropriate portions of this vitamin as an over dose might cause adverse affects to your health. Vitamin B3 or Niacin ...",https://food.ndtv.com/health/7-health-benefits-of-vitamin-b3-niacin-1669811
niacin+(Vitamin+B3),Amazon Best Sellers: Best Vitamin B3 (Niacin) Supplements,Discover the best Vitamin B3 (Niacin) Supplements in Best Sellers. Find the top 100 most popular items in Amazon Health & Personal Care Best Sellers.,https://www.amazon.com/Best-Sellers-Health-Personal-Care-Vitamin-B3-Niacin-Supplements/zgbs/hpc/3774701
niacin+(Vitamin+B3),Niacin | Linus Pauling Institute | Oregon State University,"Aug 10, 2018 ... Niacin or vitamin B3 is a water-soluble vitamin used by the body to form ... In healthy individuals, less than 2% of dietary tryptophan is ...",https://lpi.oregonstate.edu/mic/vitamins/niacin
niacin+(Vitamin+B3),"NOW Supplements, Niacin (Vitamin B-3) 500 mg ... - Amazon.com","Buy NOW Supplements, Niacin (Vitamin B-3) 500 mg, Essential B-Group Vitamin*, Nutritional Health, 100 Capsules on Amazon.com ✓ FREE SHIPPING on qualified ...",https://www.amazon.com/NOW-Niacin-500-100-Capsules/dp/B004LVW8TU
niacin+(Vitamin+B3),"Niacin: Health Benefits, Side Effects, Uses, Dose & Precautions","Jun 11, 2021 ... When taken as a supplement, niacin is often found in combination with other B vitamins. Do not confuse niacin with niacinamide, inositol ...",https://www.rxlist.com/niacin/supplements.htm
niacin+(Vitamin+B3),Niacin: MedlinePlus Medical Encyclopedia,"Feb 2, 2019 ... Niacin is a type of B vitamin. It is water-soluble vitamin. It is not stored in the body. Water-soluble vitamins dissolve in water.",https://medlineplus.gov/ency/article/002409.htm
niacin+(Vitamin+B3),Top 10 Foods Highest in Vitamin B3 (Niacin),"Vitamin B3, or niacin, is an essential vitamin required for processing fat in the body, lowering ...",https://www.myfooddata.com/articles/foods-high-in-niacin-vitamin-B3.php
