Pyrophosphate,Why phosphate additives will be the next taboo ingredient - The ...,"Mar 30, 2017 ... Phosphorus is a mineral that's naturally found in milk products, nuts, eggs and poultry. We need phosphorus in our diets for bone health and ...",https://www.washingtonpost.com/lifestyle/wellness/why-phosphate-additives-will-be-the-next-taboo-ingredient/2017/03/29/7dd3247a-02cf-11e7-b1e9-a05d3c21f7cf_story.html
Tuna,"Is Canned Tuna Healthy? Nutrition, Benefits, and Downsides","Nov 6, 2020 ... Canned tuna is a nutritious and inexpensive source of protein. Because cans of tuna last for several years, they are excellent for stocking your ...",https://www.healthline.com/nutrition/is-canned-tuna-healthy
Tuna,"Tuna Health Benefits, Nutrients per Serving, Preparation Information ...","Sep 19, 2020 ... Tuna is one of the best dietary sources of vitamin D. Just 3 ounces of canned tuna yield as much as 50% of the recommended daily level. Vitamin ...",https://www.webmd.com/diet/health-benefits-tuna
Tuna,"Dangerous Side Effects of Canned Tuna, Says Science | Eat This ...","Jan 21, 2021 ... Canned tuna is among the healthiest, most affordable sources of protein you can buy. The fish is rich in anti-inflammatory, heart-protective ...",https://www.eatthis.com/dangerous-side-effects-canned-tuna/
Tuna,How Much Tuna Is Safe to Eat?,"Mar 9, 2020 ... Healthy Nutrition From Tuna ... Tuna, for its part, is a source of high-quality protein with very little saturated fat. It contains all essential ...",https://www.thespruceeats.com/is-tuna-healthy-2122477
Tuna,Is Canned Tuna Healthy? | EatingWell,"Feb 13, 2020 ... ""Seafood like tuna contains a powerhouse of nutrients including lean protein, antioxidants like selenium, and omega-3 fatty acids, which play a ...",https://www.eatingwell.com/article/7651051/is-canned-tuna-healthy/
Tuna,Is Canned Tuna Healthy? Nutritionists Weigh In,"Dec 13, 2019 ... In addition to being a great protein source, canned tuna also contains key nutrients like vitamin D and omega-3 fatty acids, says Jessica ...",https://www.womenshealthmag.com/food/a30123531/is-canned-tuna-healthy/
Tuna,Tuna Nutrition | All Your Questions Answered - Bumble Bee Seafood,"1. Is canned tuna fish good for you? Yes, canned tuna is a healthful food rich in protein and contains many vitamins and minerals such as B- ...",https://www.bumblebee.com/seafood-school/tuna-101/tuna-nutrition-all-your-questions-answered/
Tuna,"8 Incredible Benefits Of Tuna: Heart Health, Weight Loss And More ...","Jun 28, 2018 ... The fish is a powerhouse of essential nutrients such as omega-3 fatty acids, potassium, magnesium, iron, vitamin A, B6 and B12, and as such is ...",https://food.ndtv.com/food-drinks/8-incredible-benefits-of-tuna-heart-health-weight-loss-and-more-1662263
Tuna,Is canned tuna healthy? - BBC Good Food,"Jun 25, 2020 ... Tuna is a great source of protein and can be eaten for lunch or dinner as part of a healthy diet. Canned tuna is great in sandwiches, wraps, on ...",https://www.bbcgoodfood.com/howto/guide/canned-tuna-healthy
Tuna,Healthy Tuna Salad {No Mayonnaise!} - FeelGoodFoodie,"Jul 16, 2020 ... A lot people who are on a weight loss diet will turn to tuna because of its high level of protein – 3 oz of albacore tuna has 20g of protein but ...",https://feelgoodfoodie.net/recipe/healthy-tuna-salad/
Tuna,Healthy Tuna Salad (That Tastes Good) - iFOODreal.com,"Jun 5, 2021 ... Tuna in itself contains many healthy benefits. It is an inexpensive source of protein, low fat and a good source of omega-3 fatty acids. These ...",https://ifoodreal.com/healthy-tuna-salad/
Tuna,"Is Canned Tuna Healthy? Nutrition, Benefits, and Downsides","Jan 26, 2021 ... Canned tuna is a lean protein, so it's low in fat. You need the amino acids from protein to help build and maintain muscle. Even when you eat it ...",https://greatist.com/eat/is-canned-tuna-healthy
Tuna,Top 10 Reasons to Not Eat Tuna | PETA,"Jun 25, 2020 ... Eating fish is not healthy for your heart! Heavy metals are concentrated in tuna because of the contaminated fish they eat.",https://www.peta.org/living/food/top-10-reasons-eat-tuna/
Tuna,How to Make Healthy Tuna Salad That's Still Delicious,"Jan 9, 2019 ... You don't need full-fat dressing for a great tuna fish sandwich. Learn how to make healthy tuna salad that cuts the fat but keeps the ...",https://www.tasteofhome.com/article/how-to-make-healthy-tuna-salad/
Tuna,BEST Tuna Salad Recipe - Easy & Healthy - Downshiftology,"Apr 4, 2020 ... Tuna salad is a light and fresh comfort food classic. Made with a few simple ingredients it's an easy, flavorful and healthy lunch recipe.",https://downshiftology.com/recipes/tuna-salad/
Tuna,Is Tuna Heart Healthy? - Cholesterol,"Dec 13, 2010 ... Tuna is a great addition to a heart healthy diet, providing high levels of heart healthy omega 3 fatty acids. However, how you prepare the tuna ...",https://www.healthcentral.com/article/is-tuna-heart-healthy
Tuna,Is Tuna Good for Your Health? Healthy Tuna Diet - Global Seafoods ...,"May 23, 2017 ... We'll start with a basic, easy question. Yes, tuna is healthy. Most seafood is very good for you, and doctors and dieticians suggest eating fish ...",https://globalseafoods.com/blogs/news/is-tuna-good-for-your-health
Tuna,Mercury alert: Is canned tuna safe? | Environmental Defense Fund,Seafood Selector: Which fish are healthy to eat? Where does mercury come from? Mercury comes from both natural sources — like volcanoes — as well as man-made ...,https://www.edf.org/oceans/mercury-alert-canned-tuna-safe
Tuna,Tuna: Risks and how often to eat it,"Canned tuna is frequently a major source of mercury in the diet. However, tuna also provides a wealth ... We cover an A to Z of popular healthy food items.",https://www.medicalnewstoday.com/articles/306246
Tuna,Healthy Fish Choices for Kids - HealthyChildren.org,"Sep 8, 2021 ... Adding fish to your child's diet is an excellent way to reel in a prize catch of important nutrients. Most seafood (fish and shellfish like ...",https://www.healthychildren.org/English/safety-prevention/all-around/Pages/Protecting-Your-Children-From-Contaminated-Fish.aspx
Carbonated+Water,Is Seltzer Water Just as Healthy as Flat Water? - The New York Times,"Sep 14, 2021 ... Nutritionists agree that carbonated water (a category that includes seltzer water, which is artificially carbonated, and naturally sparkling ...",https://www.nytimes.com/2021/09/14/well/eat/seltzer-water-benefits.html
Carbonated+Water,Are sparkling water drinks or hard seltzers bad for you? - UChicago ...,"Jun 11, 2021 ... Carbonated water is a healthier alternative to soda, juice or sports drinks like Gatorade. Hard seltzers tend to have fewer calories than ...",https://www.uchicagomedicine.org/forefront/health-and-wellness-articles/is-carbonated-water-healthy
Carbonated+Water,Carbonated (Sparkling) Water: Good or Bad?,"Carbonated water has benefits for digestion. It may improve swallowing, increase feelings of fullness, and reduce constipation.",https://www.healthline.com/nutrition/carbonated-water-good-or-bad
Carbonated+Water,"Sparkling Water: Are There Benefits? Pros and Cons, Nutrition ...","Oct 6, 2020 ... Drinking sparkling water can help stave off dehydration. If you're dehydrated, you may experience dry mouth, fatigue, headache, and impaired ...",https://www.webmd.com/diet/sparkling-water-health-benefits
Carbonated+Water,Is Carbonated Water Bad for You?,"Carbonated water has benefits for digestion. It may improve swallowing, increase feelings of fullness, and reduce constipation.",https://www.healthline.com/health/food-nutrition/is-carbonated-water-bad-for-you
Carbonated+Water,Is Sparkling Water Bad For You? | Right as Rain by UW Medicine,"Jul 11, 2019 ... As long as there are no added sugars, sparkling water is just as healthy as still water. · Unlike sodas, carbonated waters don't affect your bone ...",https://rightasrain.uwmedicine.org/body/food/sparkling-water
Carbonated+Water,Is Sparkling Water Good or Bad for You? | Everyday Health,"Jul 2, 2021 ... So while sparkling water is not as safe for your smile as still water is, it's not nearly as risky as regular soda or juice — plus, it's free ...",https://www.everydayhealth.com/diet-nutrition/diet/lacroix-sued-sparkling-water-healthy/
Carbonated+Water,How Healthy Is Sparkling or Mineral Water? – Cleveland Clinic,"Mar 18, 2021 ... Mineral water is often naturally carbonated. But store-bought varieties differ from what you get from a home soda stream. Depending on the brand ...",https://health.clevelandclinic.org/how-healthy-is-your-favorite-sparkling-or-mineral-water/
Carbonated+Water,Sparkling water: Facts and more,"Although carbonated water does not cause irritable bowel syndrome (IBS), its consumption may cause a person's symptoms to flare up, and ...",https://www.medicalnewstoday.com/articles/is-carbonated-sparkling-water-bad-for-you
Carbonated+Water,Is sparkling water really bad for you? - BBC Future,"Sep 11, 2015 ... So if you want a change from plain old water, then although it's mildly acidic, so far there isn't strong evidence to suggest that it's harmful ...",https://www.bbc.com/future/article/20150911-is-sparkling-water-really-bad-for-you
Carbonated+Water,Is seltzer water healthy?,"May 7, 2020 ... Well, there isn't much evidence that sparkling water is bad for you. If you are more likely to drink water when it is carbonated, there is not ...",https://theconversation.com/is-seltzer-water-healthy-136670
Carbonated+Water,Is Sparkling Water Good for You? | Is La Croix Healthy?,"Jan 21, 2021 ... Seltzer and sparkling water aren't as healthy as regular water because carbonation can damage your teeth, dehydrate you, and hinder calcium ...",https://www.runnersworld.com/nutrition-weight-loss/a25242233/is-seltzer-healthy/
Carbonated+Water,Can Sparkling Water Replace Regular Water? | Houston Methodist ...,"Oct 2, 2019 ... Sparkling water seems to be as healthy as regular water · Reduce the feeling of needing to persistently clear your throat · Help you feel full for ...",https://www.houstonmethodist.org/blog/articles/2019/oct/can-sparkling-water-replace-regular-water/
Carbonated+Water,"By the way, doctor: Does carbonated water harm bones? - Harvard ...","Effective Writing for Health Care ... Still, carbonated beverages have long been associated with low bone density and fractures in adolescent girls. To ...",https://www.health.harvard.edu/staying-healthy/does-carbonated-water-harm-bones
Carbonated+Water,Is Carbonated Water Good For You? - Scripps Health,"Oct 2, 2019 ... “Carbonated water is just as efficient at hydrating the body as plain spring or purified water. Plus, it can be a nice break from tap water,” ...",https://www.scripps.org/news_items/5224-are-carbonated-beverages-harming-your-health
Carbonated+Water,Is Sparkling Water Bad for You? - Carbonated Water Benefits and ...,"Jan 7, 2021 ... All in all, there isn't major evidence that plain sparkling water — carbonated beverages with no added sugar or other ingredients — has harmful ...",https://www.goodhousekeeping.com/health/diet-nutrition/a34524298/is-carbonated-water-good-or-bad-for-you/
Carbonated+Water,Is Sparkling Water Good for You? | Glamour,"Sep 1, 2021 ... Due to the fizziness, some might incorrectly assume that sparkling water is bad for you. In reality, sparkling water is just as healthy as ...",https://www.glamour.com/story/is-sparkling-water-good-for-you
Carbonated+Water,How healthy is carbonated water? - CBS News,"Nov 11, 2015 ... Carbonated water is a popular option for many consumers looking for a a healthier option than soda and other sugary beverages.",https://www.cbsnews.com/news/how-healthy-is-carbonated-water/
Carbonated+Water,Can you drink too much seltzer? Here's everything you need to know.,"Aug 1, 2018 ... “Having seltzer water can keep a person hydrated however if the carbonation causes gas or bloating it may also cause cramps and can disrupt the ...",https://www.nbcnews.com/better/health/can-you-drink-too-much-seltzer-here-s-everything-you-ncna895836
Carbonated+Water,Is Sparkling Water Bad For You? Experts Say Don't Sweat It,"Sep 23, 2021 ... Among the large variety of carbonated drinks, hard seltzers emerged as a health-conscious alternative to alcohol, boasting low calorie, sugar, ...",https://www.verywellhealth.com/sparkling-water-seltzer-health-obsession-5202603
Sucrose,Bad Sugar Vs Good Sugar: Guide To Sucrose and Glucose | Rowdy ...,"Mar 14, 2018 ... Sucrose can also be found in some fruits and vegetables. When sucrose is digested it breaks down into fructose and glucose, which then go their ...",https://rowdybars.com/blogs/rowdy-blog/bad-sugar-vs-good-sugar
Sucrose,Sucrose vs Glucose vs Fructose: What's the Difference?,"Jun 8, 2018 ... Not all sugars are created equal, which matters when it comes to your health. Here's the difference between sucrose, glucose and fructose.",https://www.healthline.com/nutrition/sucrose-glucose-fructose
Sucrose,The Effects of Sucrose on Metabolic Health: A Systematic Review of ...,"Apr 5, 2013 ... A high sucrose diet does not have detrimental effects on body weight or composition, or on BP. It does seem to increase sympathoadrenal activity ...",https://www.ncbi.nlm.nih.gov/pmc/articles/PMC3630450/
Sucrose,What Are the Dangers of Sucrose? | Livestrong.com,"Sep 11, 2019 ... Sucrose, or table sugar, is caloric but devoid of nutrients. Excess intake leads to weight gain, blood sugar problems, addictive eating and ...",https://www.livestrong.com/article/205180-what-are-the-dangers-of-sucrose/
Sucrose,Sucrose vs. Fructose: What's the Difference?,Health Impacts of Sucrose and Fructose. A hot-button health topic is sugar's role in your diet. Knowing how ...,https://www.webmd.com/diet/whats-the-difference-between-sucrose-and-fructose
Sucrose,Are certain types of sugars healthier than others? - Harvard Health,"May 30, 2019 ... Most people consume many different types of sugars from a variety of foods and beverages in their diet. A high intake of sugar is linked to ...",https://www.health.harvard.edu/blog/are-certain-types-of-sugars-healthier-than-others-2019052916699
Sucrose,Is Sucralose Bad for You? The Truth About Splenda – Cleveland Clinic,"Jan 12, 2021 ... Artificial sweeteners seem like a perfect way to satisfy a sweet tooth without the calories. But is sucralose (Splenda®) really a healthy ...",https://health.clevelandclinic.org/is-sucralose-splenda-bad-for-you/
Sucrose,Sugar Industry Suppressed Evidence of Health Risks of Sucrose ...,"Nov 21, 2017 ... The sugar industry buried scientific research almost 50 years ago that pointed to negative health effects of sugar, ceasing funding the ...",https://www.ucsf.edu/news/2017/11/409116/sugar-industry-suppressed-evidence-health-risks-sucrose
Sucrose,Why is sucrose (sugar) bad for health when it is broken down into ...,Sucrose is not bad for health. What is potentially bad for health is a diet where a substantial part of calories are from sucrose.,https://www.quora.com/Why-is-sucrose-sugar-bad-for-health-when-it-is-broken-down-into-glucose-and-fructose-which-are-harmless-and-basic-sources-of-energy
Sucrose,Berries modify the postprandial plasma glucose response to sucrose ...,"Nov 24, 2009 ... Sucrose increases postprandial blood glucose concentrations, and diets with a ... plasma glucose response to sucrose in healthy subjects.",https://pubmed.ncbi.nlm.nih.gov/19930765/
Sucrose,Healthy Truth About Sucrose - American Crystal Sugar Company,"In two studies based on a large, prospective study of U.S. women, sucrose and carbohydrate intake were not associated with an increased risk of diabetes.",https://www.crystalsugar.com/sugar-agri-products/sugar-faqs/healthy-truth/
Sucrose,Relative sweetness of fructose compared with sucrose in healthy ...,"Fructose is credited with some advantages over sucrose: it causes less of an increment in plasma glucose and insulin response, and the taste is sweeter.",https://pubmed.ncbi.nlm.nih.gov/2758952/
Sucrose,Everything You Need to Know About Sucralose – Food Insight,"Apr 28, 2021 ... Three select hydroxyl groups on the sucrose molecule are replaced with three ... Leading global health authorities such as the European Food ...",https://foodinsight.org/everything-you-need-to-know-about-sucralose/
Sucrose,Amphetamine alters neural response to sucrose in healthy women,Amphetamine alters neural response to sucrose in healthy women. Psychiatry Res Neuroimaging. 2016 Jun 30;252:19-25. doi: 10.1016/j.pscychresns.2016.04.017.,https://pubmed.ncbi.nlm.nih.gov/27179312/
Sucrose,Berries modify the postprandial plasma glucose response to sucrose ...,"Nov 24, 2009 ... A total of twelve healthy subjects (eleven women and one man, aged 25–69 years) with normal fasting plasma glucose ingested 150 g of the berry ...",https://www.cambridge.org/core/journals/british-journal-of-nutrition/article/berries-modify-the-postprandial-plasma-glucose-response-to-sucrose-in-healthy-subjects/A57604F6BC4BD6FA34317D50650EA918
Sucrose,Effect of glucose and sucrose on cognition in healthy humans: a ...,"Jan 9, 2021 ... Effect of glucose and sucrose on cognition in healthy humans: a systematic review and meta-analysis of interventional studies. Nutr Rev.",https://pubmed.ncbi.nlm.nih.gov/32585003/
Sucrose,Fructose Vs. Sucrose: Which Is The Healthier Option?,"Sucrose Can Cause A Spike In Your Blood Sugar Levels ... It's true that sugar is a carb that your body needs for energy. However, that does not make it a healthy ...",https://betterme.world/articles/fructose-vs-sucrose/
Sucrose,How Is Sucrose Different Than Sucralose?,"Sucralose, a sugar substitute, may be a healthier, calorie-free alternative. Sucrose Facts. Sucrose is more commonly called sugar, or table sugar. Depending ...",https://healthyeating.sfgate.com/sucrose-different-sucralose-7379.html
Sucrose,Is Sucrose Bad for You?,"It's virtually impossible to eat enough plant foods that natural sucrose could pose a health problem, but it's quite easy to consume too much refined ...",https://woman.thenest.com/sucrose-bad-you-9526.html
Sucrose,Sucrose and Warmth for Analgesia in Healthy Newborns: An RCT ...,"Mar 1, 2015 ... Nonpharmacologic techniques (sucrose taste, pacifier suckling, breastfeeding) are effective and now widely used to combat minor neonatal pain.",https://pediatrics.aappublications.org/content/135/3/e607
Glucose,What Is Glucose and What Does It Do?,"Mar 24, 2017 ... Maintaining glucose levels near the normal range is an important part of keeping your body running effectively and healthily. People who have ...",https://www.healthline.com/health/glucose
Glucose,"Blood Glucose (Blood Sugar): How It's Made, How It's Used, Healthy ...","Jun 13, 2020 ... Most of the cells in your body use glucose along with amino acids (the building blocks of protein) and fats for energy. But it's the main source ...",https://www.webmd.com/diabetes/glucose-diabetes
Glucose,Sucrose vs Glucose vs Fructose: What's the Difference?,"Jun 8, 2018 ... Not all sugars are created equal, which matters when it comes to your health. Here's the difference between sucrose, glucose and fructose.",https://www.healthline.com/nutrition/sucrose-glucose-fructose
Glucose,Blood Sugar Levels: How Glucose Levels Affect Your Body,"Dec 6, 2020 ... Over time, high blood sugar can lead to many different health problems. Learn more about what they are and how to prevent them.",https://www.webmd.com/diabetes/how-sugar-affects-diabetes
Glucose,Are certain types of sugars healthier than others? - Harvard Health,"May 30, 2019 ... Fructose and glucose are also found naturally in honey as well as in common table sugar. Added versus natural sugars ...",https://www.health.harvard.edu/blog/are-certain-types-of-sugars-healthier-than-others-2019052916699
Glucose,Diabetes - Diagnosis and treatment - Mayo Clinic,"Oct 30, 2020 ... If you have prediabetes, healthy lifestyle choices can help you bring your blood sugar level back to normal or at least keep it from rising ...",https://www.mayoclinic.org/diseases-conditions/diabetes/diagnosis-treatment/drc-20371451
Glucose,"Healthy blood glucose levels: Targets, extremes, and lifestyle tips",Share on Pinterest A healthy blood sugar levels is below 99 mg/dL. Health authorities consider a normal fasting blood sugar level to be below 99 milligrams per ...,https://www.medicalnewstoday.com/articles/249413
Glucose,Glucose Health Inc.,"Glucose Health, Inc. conceived the idea of manufacturing a healthy or functional tea beverage for the emerging diabetic nutritionals consumer market ...",https://glucosehealthinc.com/
Glucose,Blood Glucose Test: Levels & What They Mean,"Feb 21, 2018 ... Normal blood glucose levels typically range from 70 to 99 mg/dL. ... *Values between 50 and 70 are often seen in healthy people.",https://my.clevelandclinic.org/health/diagnostics/12363-blood-glucose-test
Glucose,Diabetic-level glucose spikes seen in healthy people | News Center ...,"Jul 24, 2018 ... A study out of Stanford in which blood sugar levels were continuously monitored reveals that even people who think they're “healthy” should ...",https://med.stanford.edu/news/all-news/2018/07/diabetic-level-glucose-spikes-seen-in-healthy-people.html
Glucose,Diabetic-level glucose spikes seen in healthy people | News Center ...,"Jul 24, 2018 ... A study out of Stanford in which blood sugar levels were continuously monitored reveals that even people who think they're “healthy” should ...",https://med.stanford.edu/news/all-news/2018/07/diabetic-level-glucose-spikes-seen-in-healthy-people.html
Glucose,Continuous Glucose Monitoring | NIDDK,"Learn about continuous glucose monitors (CGM) for diabetes—how they work, ... good management of glucose greatly helps people with diabetes stay healthy and ...",https://www.niddk.nih.gov/health-information/diabetes/overview/managing-diabetes/continuous-glucose-monitoring
Glucose,The Big Picture: Checking Your Blood Sugar | ADA,"This tells you your blood glucose level at any one time. It's important for blood sugar levels to stay in a healthy range. If glucose levels get too low, we can ...",https://www.diabetes.org/healthy-living/medication-treatments/blood-glucose-testing-and-control/checking-your-blood-sugar
Glucose,What is Diabetes? | NIDDK,"What health problems can people with diabetes develop? Diabetes is a disease that occurs when your blood glucose, also called blood sugar, is too high. Blood ...",https://www.niddk.nih.gov/health-information/diabetes/overview/what-is-diabetes
Glucose,Effects of acute intermittent hypoxia on glucose metabolism in ...,Thirteen healthy volunteers were subjected to 5 h of intermittent hypoxia or normoxia during wakefulness in a randomized order on two separate days. The ...,https://pubmed.ncbi.nlm.nih.gov/19265062/
Glucose,Low Blood Glucose (Hypoglycemia) | NIDDK,"have type 1 diabetes · take insulin or some other diabetes medicines · are age 65 or older · had low blood glucose before · have other health problems, such as ...",https://www.niddk.nih.gov/health-information/diabetes/overview/preventing-problems/low-blood-glucose-hypoglycemia
Glucose,Manage Blood Sugar | Diabetes | CDC,"Apr 28, 2021 ... Learn how managing your blood sugar levels can help you feel better now and prevent or delay serious health problems later.",https://www.cdc.gov/diabetes/managing/manage-blood-sugar.html
Glucose,Carbohydrates and Blood Sugar | The Nutrition Source | Harvard ...,See why different carbs have varying effects on blood sugar. ... sugar and insulin secretion from the pancreas – which can have negative health effects.,https://www.hsph.harvard.edu/nutritionsource/carbohydrates/carbohydrates-and-blood-sugar/
Glucose,Health & Wellness | Kaiser Permanente,"... of helpful wellness resources, learn more about possible health concerns, ... and natural medicines, and check out our healthy living programs and classes.",https://healthy.kaiserpermanente.org/health-wellness
Glucose,Which Sugars Are Good for You — and Which Ones to Avoid ...,"Feb 17, 2021 ... And the lactose in milk comes with a healthy serving of protein that ... high blood glucose contributes to health problems such as obesity, ...",https://www.everydayhealth.com/diet-and-nutrition/diet/which-sugars-are-good-you-which-ones-avoid/
Taurine,Taurine in energy drinks: What is it? - Mayo Clinic,"While research is mixed, some studies suggest that taurine supplementation might improve athletic performance. And, in one study, people with congestive heart ...",https://www.mayoclinic.org/healthy-lifestyle/nutrition-and-healthy-eating/expert-answers/taurine/faq-20058177
Taurine,"What Is Taurine? Benefits, Side Effects and More","Research shows a link between higher taurine levels and significantly lower rates of death from heart disease, as well as reduced cholesterol ...",https://www.healthline.com/nutrition/what-is-taurine
Taurine,"TAURINE: Overview, Uses, Side Effects, Precautions, Interactions ...",Taurine has important functions in the heart and brain. It helps support nerve growth. It might also benefit people with heart failure by lowering blood ...,https://www.webmd.com/vitamins/ai/ingredientmono-1024/taurine
Taurine,Taurine: Benefits and risks,"Oct 17, 2019 ... Promoting healthy metabolism ... Taurine plays an essential role in metabolism and digestion, as it helps the liver to create bile salts. Bile ...",https://www.medicalnewstoday.com/articles/326714
Taurine,The potential health benefits of taurine in cardiovascular disease,"Taurine was found to exhibit diverse biological actions, including protection against ischemia-reperfusion injury, modulation of intracellular calcium ...",https://www.ncbi.nlm.nih.gov/pmc/articles/PMC2586397/
